Type 2 Diabetes Detection With Light CNN From Single Raw PPG Wave,S. Zanelli; M. A. E. Yacoubi; M. Hallab; M. Ammi,"Laboratoire Analyse, Géométrie et Applications (LAGA), University of Sorbonne Nord Paris, Villetaneuse, France; SAMOVAR Telecom SudParis, Institut Polytechnique de Paris, Palaiseau, France; Clinique Bizet, Paris, France; Laboratoire Analyse, Géométrie et Applications (LAGA), University of Sorbonne Nord Paris, Villetaneuse, France",IEEE Access,15-Jun-23,2023,11,,57652,57665,"Photoplethysmography (PPG) is a non-invasive and cost-efficient optical technique used to assess blood volume variations in the microcirculation. PPG technology is widely used in a variety of wearable sensors to investigate the cardiovascular system. Recent studies have demonstrated the utility of PPG analysis for carrying out large-scale screening to prevent and detect diabetes. However, most of these studies require feature extraction and/or several pre-processing steps. Over the past few years, the advent of deep learning has significantly impacted the analysis of biomedical signals. Despite their success in other fields, however, very few studies have focused on the application of deep learning to raw PPG signals for detecting diabetes. Existing studies have proposed large models trained on large amounts of data. In this paper, we present a Light CNN-based model for screening the presence of type 2 diabetes using a single raw pulse extracted from photoplethysmographic signals. In addition to the baseline architecture, we evaluate different model architectures that take as input age and biological sex or PPG handcrafted features. Furthermore, we apply transfer learning to all the tested architectures to evaluate the effectiveness of harnessing pre-trained models in detecting diabetes. We tested a model pre-trained on a general PPG shape dataset and another model pre-trained on a dataset containing hypertension PPG signals. Our model scored an AUC of 75.5 when trained with raw PPG waves, age, and biological sex without applying transfer learning, which is competitive with current state of the art.",2169-3536,,10.1109/ACCESS.2023.3274484,,https://ieeexplore.ieee.org/stamp/stamp.jsp?arnumber=10121422,Deep learning;photoplethysmography;screening;signal processing;type 2 diabetes;transfer learning,Diabetes;Biological system modeling;Feature extraction;Transfer learning;Convolutional neural networks;Data models;Blood;Deep learning;Signal processing;Photoplethysmography,,6,,35,CCBYNCND,8-May-23,,,IEEE,IEEE Journals
Intelligent Near-Infrared Spectroscopy for Blood Glucose Level Classification,S. Sharifi; A. Maddah-T.; M. -R. Akbarzadeh-T.,"Department of Electrical Engineering Ferdowsi, University of Mashhad, Mashhad, Iran; Department of Electrical Engineering Ferdowsi, University of Mashhad, Mashhad, Iran; Centre of Excellence on Soft Computing and Intelligent Information Processing Ferdowsi, University of Mashhad, Mashhad, Iran",2024 32nd International Conference on Electrical Engineering (ICEE),19-Sep-24,2024,,,1,5,"Diabetes Mellitus is a disease characterized by inadequate control of blood glucose levels, and it ranks among the leading causes of human mortality, the measurement of which, requires fingertip pricking. Nowadays, non-invasive healthcare monitoring systems based on wearable sensors and machine learning models hold the future of smart health. However, the nature of these methods is such that they get affected by internal physiological and external parameters, which is one of the obstacles to this path. This study aims to introduce a non-invasive blood glucose level classification method based on machine learning analysis. The device's sensor consists of an optical finger sensor that transmits near-infrared light, filtering, and amplification to reduce the noise of the extracted photoplethysmography signal. Moreover, we have adopted the four-stage framework of biomedical signal processing to analyze the acquired PPG signal. Before using the Savitzky-Golay derivation to pre-filter the signal and prepare it for feature extraction, it was normalized using Standard Normal Variate (SNV). In addition, four different machine learning models, including Support Vector Machine (SVM), Weighted K-Nearest Neighbors (KNN), Wide Neural Network, and Decision Tree were used for blood glucose level classification. For this study, a dataset was created consisting of 106 data, gathered from 27 subjects. Findings revealed that the Weighted KNN exhibited the best performance among other classification models, having 90.5% accuracy.",2642-9527,979-8-3503-7634-0,10.1109/ICEE63041.2024.10668364,Ferdowsi University of Mashhad(grant numbers:IR.UM.REC.1402.110); ,https://ieeexplore.ieee.org/stamp/stamp.jsp?arnumber=10668364,Blood Glucose;Photoplethysmography signal;NIR Spectroscopy;Biomedical Signal Processing;Feature Extraction;Machine Learning;Classification;Confusion Matrix,Support vector machines;Stimulated emission;Smart healthcare;Machine learning;Nearest neighbor methods;Feature extraction;Glucose,,,,23,IEEE,19-Sep-24,,,IEEE,IEEE Conferences
Non-invasive Body Vitalities Checking System,S. Borker; M. Gaunekar; A. Mishra; M. Colaco; A. Cotta,"Electronics and telecommunication, Don Bosco College of Engineering, Goa, India; Electronics and telecommunication, Don Bosco College of Engineering, Goa, India; Electronics and telecommunication, Don Bosco College of Engineering, Goa, India; Electronics and telecommunication, Don Bosco College of Engineering, Goa, India; Electronics and telecommunication, Don Bosco College of Engineering, Goa, India",2021 IEEE Bombay Section Signature Conference (IBSSC),11-Jan-22,2021,,,1,5,"People in current times suffer from several long- term health issues like blood pressure fluctuations, diabetes, heart issues, etc. Currently, there are existing devices for each parameter but buying each is inconvenient and expensive. Also, not all the available devices are non-invasive. With the rise in the number of people being conscious about their health, there is a need to develop a non-invasive device that checks on different health parameters in the human body like blood glucose, thyroid hormone, blood pressure, blood lipids, and heart rate. The idea is to have one single compact device for different parameters, which is as reliable as the existing individual devices and cost-effective. This report includes the research and our device development and implementation with multiple sensors aimed to send and receive signals to-and-from one’s finger depending on the target parameter. The microcontroller is used for processing all the data collected by sensors using relevant software.",,978-1-6654-1758-7,10.1109/IBSSC53889.2021.9673246,,https://ieeexplore.ieee.org/stamp/stamp.jsp?arnumber=9673246,Blood Glucose;Blood Pressure;Heart Rate;PPG and NIR,Heart rate;Microcontrollers;Medical services;Blood pressure;Software;Sensors;Glucose,,,,15,IEEE,11-Jan-22,,,IEEE,IEEE Conferences
Video Based Cocktail Causal Container for Blood Pressure Classification and Blood Glucose Prediction,C. Zhang; E. Jovanov; H. Liao; Y. -T. Zhang; B. Lo; Y. Zhang; C. Guan,"Chongqing Key Laboratory of Nonlinear Circuits and Intelligent Information Processing, College of Electronic and Information Engineering, Southwest University, Chongqing, China; Department of Electrical and Computer Engineering, University of Alabama in Huntsville, Huntsville, AL, USA; Department of Biomedical Engineering, School of Medicine, Tsinghua University, Beijing, China; Hong Kong Center for Cerebro-cardiovascular Health Engineering, Hong Kong; Department of Surgery and Cancer, Imperial College London, London, U.K.; Chongqing Key Laboratory of Nonlinear Circuits and Intelligent Information Processing, College of Electronic and Information Engineering, Southwest University, Chongqing, China; S-Lab, Nanyang Technological University, Singapore",IEEE Journal of Biomedical and Health Informatics,3-Feb-23,2023,27,2,1118,1128,"With the development of modern cameras, more physiological signals can be obtained from portable devices like smartphone. Some hemodynamically based non-invasive video processing applications have been applied for blood pressure classification and blood glucose prediction objectives for unobtrusive physiological monitoring at home. However, this approach is still under development with very few publications. In this paper, we propose an end-to-end framework, entitled cocktail causal container, to fuse multiple physiological representations and to reconstruct the correlation between frequency and temporal information during multi-task learning. Cocktail causal container processes hematologic reflex information to classify blood pressure and blood glucose. Since the learning of discriminative features from video physiological representations is quite challenging, we propose a token feature fusion block to fuse the multi-view fine-grained representations to a union discrete frequency space. A causal net is used to analyze the fused higher-order information, so that the framework can be enforced to disentangle the latent factors into the related endogenous association that corresponds to down-stream fusion information to improve the semantic interpretation. Moreover, a pair-wise temporal frequency map is developed to provide valuable insights into extraction of salient photoplethysmograph (PPG) information from fingertip videos obtained by a standard smartphone camera. Extensive comparisons have been implemented for the validation of cocktail causal container using a Clinical dataset and PPG-BP benchmark. The root mean square error of $1.329\pm 0.167$ for blood glucose prediction and precision of $0.89\pm 0.03$ for blood pressure classification are achieved in Clinical dataset.",2168-2208,,10.1109/JBHI.2022.3220967,"National Natural Science Foundation of China(grant numbers:62172340,82027807); Natural Science Foundation of Chongqing(grant numbers:cstc2021jcyj-msxmX0041); Beijing Municipal Natural Science Foundation(grant numbers:7212202); Hong Kong ITC-InnoHK grant to COCHE; ",https://ieeexplore.ieee.org/stamp/stamp.jsp?arnumber=9944662,Blood glucose prediction;blood pressure classification;deep learning;non-invasive measurement,Feature extraction;Blood;Task analysis;Multitasking;Biomedical monitoring;Glucose;Deep learning,"Humans;Blood Pressure;Blood Glucose;Algorithms;Blood Pressure Determination;Monitoring, Physiologic",10,,48,IEEE,9-Nov-22,,,IEEE,IEEE Journals
DNN Based Blood Glucose Level Estimation Using PPG Characteristic Features of Smartphone Videos,S. M. Taslim Uddin Raju; M. M. A. Hashem,"Department of Computer Science and Engineering, Khulna University of Engineering & Technology (KUET), Khulna, Bangladesh; Department of Computer Science and Engineering, Khulna University of Engineering & Technology (KUET), Khulna, Bangladesh",2022 25th International Conference on Computer and Information Technology (ICCIT),3-Mar-23,2022,,,13,18,"Diabetes is a perpetual metabolic issue that can prompt severe complications. Blood glucose level (BGL) is usually monitored by collecting a blood sample and assessing the results. This type of measurement is extremely unpleasant and inconvenient for the patient, who must undergo it frequently. This paper proposes a novel real-time, non-invasive technique for estimating BGL with smartphone photoplethysmogram (PPG) signal extracted from fingertip video and deep neural networks (DNN). Fingertip videos are collected from 93 subjects using a smartphone camera and a lighting source, and subsequently the frames are converted into PPG signal. The PPG signals have been preprocessed with Butterworth bandpass filter to eliminate high frequency noise, and motion artifact. Therefore, there are 34 features that are derived from the PPG signal and its derivatives and Fourier transformed form. In addition, age and gender are also included as features due to their considerable influence on glucose. Maximal information coefficient (MIC) feature selection technique has been applied for selecting the best feature set for obtaining good accuracy. Finally, the DNN model has been established to determine BGL non-invasively. DNN model along with the MIC feature selection technique outperformed in estimating BGL with the coefficient of determination (R2) of 0.96, implying a good relationship between glucose level and selected features. The results of the experiments suggest that the proposed method can be used clinically to determine BGL without drawing blood.",,979-8-3503-4602-2,10.1109/ICCIT57492.2022.10055090,,https://ieeexplore.ieee.org/stamp/stamp.jsp?arnumber=10055090,Smartphone;Blood Glucose Level;Photo-plethysmogram;Features Extraction;Features Selection;Deep Neural Network,Deep learning;Microwave integrated circuits;Neural networks;Streaming media;Feature extraction;Real-time systems;Glucose,,1,,17,IEEE,3-Mar-23,,,IEEE,IEEE Conferences
A Novel Technique for Non-Invasive Measurement of Human Blood Component Levels From Fingertip Video Using DNN Based Models,M. R. Haque; S. M. T. U. Raju; M. A. -U. Golap; M. M. A. Hashem,"Department of Computer Science and Engineering, Khulna University of Engineering and Technology, Khulna, Bangladesh; Department of Computer Science and Engineering, Khulna University of Engineering and Technology, Khulna, Bangladesh; Department of Computer Science and Engineering, Khulna University of Engineering and Technology, Khulna, Bangladesh; Department of Computer Science and Engineering, Khulna University of Engineering and Technology, Khulna, Bangladesh",IEEE Access,17-Feb-21,2021,9,,19025,19042,"Blood components such as hemoglobin, glucose, creatinine measuring are essential for monitoring one's health condition. The current blood component measurement approaches still depend on invasive techniques that are painful, and uncomfortable for the patients. To facilitate measurement at home, we proposed a novel non-invasive technique to measure blood hemoglobin, glucose, and creatinine level based on PPG signal using Deep Neural Networks (DNN). Fingertip videos from 93 subjects have been collected using a smartphone. The PPG signal is generated from each video, and 46 characteristic features are then extracted from the PPG signal, its derivatives (1st and 2nd) and from Fourier analysis. Additionally, age and gender are also included to feature because of the significant effects on hemoglobin, glucose, and creatinine. A correlation-based feature selection (CFS) using genetic algorithms (GA) has been used to select the optimal features to avoid redundancy and over-fitting. Finally, DNN based models have been developed to estimate the blood Hemoglobin (Hb), Glucose (Gl), and Creatinine (Cr) levels from the selected features. The approach provides the best-estimated accuracy of R2 = 0.922 for Hb, R2 = 0.902 for Gl, and R2 = 0.969 for Cr. Experimental aftermaths show that the proposed method is a suitable technique to be used clinically to measure human blood component levels without taking blood samples. This paper also reveals that smartphone-based PPG signal has a great potential to measure the different blood components.",2169-3536,,10.1109/ACCESS.2021.3054236,"Khulna University of Engineering & Technology, Khulna, Bangladesh; ",https://ieeexplore.ieee.org/stamp/stamp.jsp?arnumber=9335002,Smartphone;non-invasive technique;hemoglobin;glucose;creatinine;NIR LED;photoplethysmogram;features extraction;features selection;deep neural networks,Blood;Feature extraction;Videos;Glucose;Light emitting diodes;Monitoring;Lighting,,20,,60,CCBY,25-Jan-21,,,IEEE,IEEE Journals
PPG-Based Smart Wearable Device With Energy-Efficient Computing for Mobile Health-Care Applications,E. Lee; C. -Y. Lee,"Institute of Electronics, National Chiao Tung University, Hsinchu, Taiwan; Institute of Electronics, National Chiao Tung University, Hsinchu, Taiwan",IEEE Sensors Journal,14-Jun-21,2021,21,12,13564,13573,"Individualized health-care is gaining traction recently due to the advances in sensor technology, edge computing and the improvement in communication technologies. In this work, we show the application of wearable device for mobile health-care along with supporting algorithms using photoplethysmogram (PPG) as our signal source. We introduce the design of our wearable device equipped PPG sensors for extracting valuable bio-information from the human body. Using our device, we introduce Centralized State Sensing (CSS), an algorithm that improves the estimation of different health parameters. By using heart rate estimation as an example, the proposed algorithm is 26.8% better in terms of mean absolute error when compared with the average reading taken across sensors. We also propose a deep neural network model applied to a PPG-glucose dataset containing 349 samples provided by our industry partner for non-invasive blood glucose estimation achieving an accuracy of 84.29% based on ISO:15197:2013 standard.",1558-1748,,10.1109/JSEN.2021.3069460,Ministry of Science and Education (MOST) of Taiwan(grant numbers:109-2124-M-009-012); Ministry of Education (MOE) of Taiwan under AiMfor High-value Creation (AMHC) Project; NOVATEK Fellowship; ,https://ieeexplore.ieee.org/stamp/stamp.jsp?arnumber=9389545,Neural networks;sensor array;non-invasive glucose estimation,Sensors;Wearable computers;Sensor arrays;Blood;Glucose;Estimation;Wearable sensors,,35,,49,IEEE,29-Mar-21,,,IEEE,IEEE Journals
"A Review of Photoplethysmography-based Physiological Measurement and Estimation, Part 1: Single Input Methods",M. S. S. Johnson; J. Mikael Eklund,"Department of Electrical, Computer and Software Engineering, University of Ontario Institute of Technology, Oshawa, Canada; Department of Electrical, Computer and Software Engineering, University of Ontario Institute of Technology, Oshawa, Canada",2020 42nd Annual International Conference of the IEEE Engineering in Medicine & Biology Society (EMBC),27-Aug-20,2020,,,923,927,"Photoplethysmography is a non-invasive and easy to administer optical method used primarily to measure blood oxygen saturation, but also used widely to estimate and measure various other physiological parameters. This paper reviews several physiological parameter estimations that have been done with just this waveform signal, i.e. heart rate, lipid profiling by morphological PPG analysis, blood glucose, ankle brachial pressure, and respiratory rate. Additional physiological estimations which use additional input measurements are reviewed in Part 2 of this paper. The different methods and signal processing techniques based on the principle of operation are discussed in this review. The validity of each of these optical measurement techniques are reviewed where the results were compared with the results obtained using the gold reference standards. Future research considerations for non-invasive wearable devices for physiological parameter measurements are also highlighted in this review which could be helpful for future research.",2694-0604,978-1-7281-1990-8,10.1109/EMBC44109.2020.9176353,,https://ieeexplore.ieee.org/stamp/stamp.jsp?arnumber=9176353,,Heart rate;Sugar;Blood;Voltage measurement;Brachytherapy;Standards;Indexes,"Heart Rate;Oximetry;Photoplethysmography;Respiratory Rate;Signal Processing, Computer-Assisted",2,,29,IEEE,27-Aug-20,,,IEEE,IEEE Conferences
Mobile Application to Collect Data and Measure Blood Component Level in a Non-Invasive Way,H. Neha; S. Sakib; F. Sadaf; S. M. Taslim Uddin Raju,"Department of Computer Science and Engineering, Khulna University of Engineering & Technology (KUET), Khulna, Bangladesh; Department of Computer Science and Engineering, Khulna University of Engineering & Technology (KUET), Khulna, Bangladesh; Department of Computer Science and Engineering, Khulna University of Engineering & Technology (KUET), Khulna, Bangladesh; Department of Computer Science and Engineering, Khulna University of Engineering & Technology (KUET), Khulna, Bangladesh",2023 26th International Conference on Computer and Information Technology (ICCIT),27-Feb-24,2023,,,1,6,"The increasing advancement in mobile technology has led to many smartphone-based technologies being widely accepted in various research fields. In recent years, promising smartphone-based technologies have been developed for activity recognition, gait analysis, telemedicine, and fitness tracking. However, some invasive methods are used for measuring blood components (hemoglobin, glucose, bilirubin, etc.). This invasive method involves drawing blood from patients and then analyzing the blood sample. This process is painful, and the time delay between the blood collection and analysis can be a significant disadvantage. Extensive research is being conducted to introduce a noninvasive method of measuring blood components. However, these methods may be expensive and inconvenient for people with little literacy. To deal with these issues, we have developed a mobile application that any group of people can use conveniently and quickly. Furthermore, this application can collect data without causing inconvenience and output blood glucose and hemoglobin levels, allowing for real-time data monitoring. A study evaluated the system’s performance, comparing invasive and noninvasive hemoglobin measurements on 15 subjects (11 male, 4 female) using this app. It was also tested on Samsung, Realme, Vivo, and Redmi phones, showing compatibility with diverse brands.",,979-8-3503-5901-5,10.1109/ICCIT60459.2023.10441186,,https://ieeexplore.ieee.org/stamp/stamp.jsp?arnumber=10441186,Smartphone;FPS;NIR LED;ISO;Exposure;Glucose;Hemoglobin;Photoplethysmogram,Telemedicine;Mobile applications;Glucose;Blood;Monitoring;Thyroid;Testing,,,,13,IEEE,27-Feb-24,,,IEEE,IEEE Conferences
Design and Implementation of Low-cost Hemoglobin Level Prediction using Machine Learning,S. B; S. J,"Department of IT, IFET College of Engineering, Villupuram, India; Department of IT, IFET College of Engineering, Villupuram, India","2022 Third International Conference on Smart Technologies in Computing, Electrical and Electronics (ICSTCEE)",18-Apr-23,2022,,,1,5,"Emerging nations have an especially pressing need for a low-cost haemoglobin measurement solution, but this demand is global. The mobile phone, which is widely used in both affluent and impoverished regions, is an excellent candidate for this remedy. Non-invasive quantification of haemoglobin levels is proposed in this Project. Methods of collecting data, theoretical underpinnings, the retrieval of photoplethysmogram (PPG) signals and functionalities, machine-learning computation, and modeling techniques for determining haemoglobin levels were also especially in comparison. Based on this evaluation, practical methods for developing a mobile phone point-of-care device for non - intrusive haemoglobin assessment were proposed. The overarching objectives of this study were about (Aim 1) test the viability of creating a technique to analyse smartphone image data of fingernails in order to estimate haemoglobin (Hgb) levels, (Aim 2) create an anaemia predictive model and legitimise it with a sizable health diagnosis ($\mathrm{n}=337$), and (Aim 3) conduct testing process and integrating this automated system into a translational, user-friendly, and low-cost smartphone app. Self-Hgb measurement by individuals with persistent anaemia using this image processing algorithm implemented in a mobile platform as just an app improves access to medical care generally and in reduced settings in particular.",,978-1-6654-5664-7,10.1109/ICSTCEE56972.2022.10099970,,https://ieeexplore.ieee.org/stamp/stamp.jsp?arnumber=10099970,Convolutional Neural Network(CNN);Segmentation;photoplethysmogram sensor (PPG);Image Filter,Machine learning algorithms;Point of care;Machine learning;Pressing;Predictive models;Prediction algorithms;Particle measurements,,,,16,IEEE,18-Apr-23,,,IEEE,IEEE Conferences
Analysis and design of a photoplethysmograph for glucose measurement using near-infrared spectroscopy analyzing human body physical and functional variables,O. I. Coronado-Reyes; A. del Carmen Téllez-Anguiano; L. A. Castro-Pimentel,"Tecnológico Nacional de México/I.T. de Morelia, Morelia, Mexico; Tecnológico Nacional de México/I.T. de Morelia, Morelia, Mexico; Tecnológico Nacional de México/I.T. de Morelia, Morelia, Mexico","2020 IEEE International Autumn Meeting on Power, Electronics and Computing (ROPEC)",25-Nov-20,2020,4,,1,6,"Diabetes mellitus is a chronic disease that increases blood glucose levels. Glucose measurement devices, called glucometers, normally use invasive techniques. These devices are used by the patients themselves. They are small size and require a lancing device to extract a drop of blood and pinpoint the glucose concentration present, This technique is uncomfortable and painful for the patient when continuous blood glucose monitoring is required throughout the day. To improve glucose measurement conditions, non-invasive blood glucose meters have been proposed using near-infrared spectroscopy. The problem that occurs when using the near-infrared spectroscopy method is the physical and functional characteristics of the human body, which interact with the light emitted making it difficult to measure glucose levels, These characteristics are, for example, the fat, pressure, humidity, temperature, among others.",2573-0770,978-1-7281-9953-5,10.1109/ROPEC50909.2020.9258674,,https://ieeexplore.ieee.org/stamp/stamp.jsp?arnumber=9258674,diabetes;glucosa;espectorscopia;infrarrojo;temperatura;grasa,Glucose;Diabetes;Temperature measurement;Spectroscopy;Power electronics;Medical diagnostic imaging;Blood,,,,,IEEE,25-Nov-20,,,IEEE,IEEE Conferences
