Noninvasive Heart Rate and Blood Glucose Level Estimation Using Photoplethysmography,S. K. Singha; M. Ahmad,"Dept. of Biomedical Engineering, Khulna University of Engineering & Technology, Khulna, Bangladesh; Dept. of Electrical and Electronic Engineering, Khulna University of Engineering & Technology, Khulna, Bangladesh",2021 International Conference on Information and Communication Technology for Sustainable Development (ICICT4SD),12-Apr-21,2021,,,151,155,"Heart rate (HR) and blood glucose level (BGL) are two important indicators of fitness of human health and it is imperative to measure these parameters regularly to avoid severe damages. At present, we need at least two devices such as electrocardiography (ECG) device and invasive BGL measuring devices to measure heart rate and blood glucose level accurately which are costly. In this paper, an easy method has been described to measure both HR and BGL values simultaneously without pricking a finger and without a trained person using a single device only based on photoplethysmography (PPG). In this research work, a pulse sensor is used for PPG signal collection. Then this PPG signal is passed through a bandpass filter for noise removal and amplification to the microcontroller unit (MCU). Then the data obtained from MCU are analyzed using MATLAB for finding HR and BGL values. The peak finding technique is used for finding HR value. For determining BGL values, the dominant feature of the PPG signal is extracted which has the highest correlation with BGL, and then using regression analysis a relationship is established from which we can measure the BGL values without pricking blood. Finally, correlation analysis is also done to analyze the relationship between HR and BGL. As PPG signal acquisition is less costly than ECG and other BGL measuring methods, it will be very helpful for determining HR and BGL values simultaneously at ease. Thus this research work will provide opportunities for early diagnosis of problems related to heart rate and blood glucose level.",,978-1-6654-1460-9,10.1109/ICICT4SD50815.2021.9396849,,https://ieeexplore.ieee.org/stamp/stamp.jsp?arnumber=9396849,Pulse sensor;peak finding;feature extraction;correlation;regression analysis,Heart rate;Correlation;Electrocardiography;Photoplethysmography;Feature extraction;Glucose;Blood,,7,,18,IEEE,12-Apr-21,,,IEEE,IEEE Conferences
Photoplethysmography and Artificial Intelligence for Blood Glucose Level Estimation in Diabetic Patients: A Scoping Review,S. Lombardi; L. Bocchi; P. Francia,"Department of Information Engineering, University of Florence, Florence, Italy; Department of Information Engineering, University of Florence, Florence, Italy; Department of Information Engineering, University of Florence, Florence, Italy",IEEE Access,5-Dec-24,2024,12,,178982,178996,"New technologies, including artificial intelligence (AI), offer significant opportunities to improve blood glucose level (BGL) estimation systems, potentially enhancing care and quality of life for diabetic patients. This study aimed to assess the accuracy of BGL estimation using photoplethysmographic signal (PPG) analysis and AI methods by comparing various studies in terms of population, PPG signal acquisition and analysis, AI approaches, and BGL estimation performance. A systematic search was conducted in Scopus, Web of Science, Embase, PubMed and CINAHL databases. Conference proceedings and book chapters were included, excluding other gray literature, focusing on English-language studies published from 2010 to February 2024. Only publications concerning PPG signal analysis using AI algorithms for noninvasive estimation of BGL in patients with diabetes were considered. Of 48 identified articles, 24 were reviewed in full text, and 5 were deemed eligible. These studies varied in methodology (populations, devices, AI solutions) and evaluation metrics. However, all studies used Clarke error grid or Parkes error grid, with over 98% of estimates falling into clinically acceptable zones A or B. Current research confirm that PPG-based BGL estimation is feasible and accurate. Further studies are needed to overcome existing limitations and make this procedure available, accurate, and easy to perform.",2169-3536,,10.1109/ACCESS.2024.3508467,,https://ieeexplore.ieee.org/stamp/stamp.jsp?arnumber=10770233,Artificial intelligence;blood glucose level;diabetes;glycemia;photoplethysmography,Diabetes;Glucose;Blood;Artificial intelligence;Reviews;Estimation;Photoplethysmography;Training;Monitoring;Diseases,,,,47,CCBY,27-Nov-24,,,IEEE,IEEE Journals
Non-invasive blood glucose detection using NIR based on GA and SVR,Y. Zhang; Z. Wang; Z. Xiao,NA; NA; NA,BIBE 2018; International Conference on Biological Information and Biomedical Engineering,23-Sep-18,2018,,,1,4,"Between the human blood glucose with photoplethysmography (PPG) signal, there is a nonlinear and complex relation. For the purpose of measuring the human blood glucose level (BGL) from PPG signal, in this paper, we propose one non-invasive blood glucose detection method using NIR based on Genetic Algorithm (GA) and Support Vector Regression (SVR). During data preprocessing, we use the wavelet transform algorithm to smooth the PPG signal and eliminate baseline drift. 23-dimensional parameters, including some physiological and environmental parameters and features calculated from PPG signal, compose the feature matrix. Genetic Algorithm is used for feature selection. Selected parameters are used for SVR model training. On the test set, we used the method based on GA and SVR to obtain a 95.05% correlation coefficient, 1.74% higher than the method using SVR only.",,978-3-8007-4727-6,,,https://ieeexplore.ieee.org/stamp/stamp.jsp?arnumber=8470665,,,,1,,,,23-Sep-18,,,VDE,VDE Conferences
Noninvasive Blood Glucose Detection System With Infrared Pulse Sensor and Hybrid Feature Neural Network,Y. Yang; J. Chen; J. Wei; Z. Wang; J. Song; Y. Zhang; Y. Zhang; J. Zhao,"College of Electronic and Information Engineering, Southwest University, Chongqing, China; Department of Endocrinology, The Ninth People’s Hospital of Chongqing, Beibei, China; College of Electronic and Information Engineering, Southwest University, Chongqing, China; Biomedicine Discovery Institute and Department of Biochemistry and Molecular Biology, Monash University, Melbourne, VIC, Australia; Biomedicine Discovery Institute and Department of Biochemistry and Molecular Biology, Monash University, Melbourne, VIC, Australia; Department of Electronic Engineering, Chinese University of Hong Kong, Hong Kong, China; College of Electronic and Information Engineering, Southwest University, Chongqing, China; Auckland Bioengineering Institute, University of Auckland, Auckland, New Zealand",IEEE Sensors Journal,15-Apr-24,2024,24,8,13385,13394,"The rising prevalence of diabetes increases the demand for daily blood glucose (BG) detection, necessitating the urgent development of noninvasive BG detection systems. To enhance the convenience of BG monitoring, we employed infrared pulsed sensing (IPS) to capture photoplethysmography (PPG) signals. PPG signals effectively reflect changes in blood volume within the human body, providing rich information about BG. In this article, we designed a BG detection system based on an IPS and a deep hybrid feature neural network. By deploying IPS and deep learning algorithms on a Raspberry Pi, the system is equipped with data collection, analysis, prediction, and display capabilities for real-time BG monitoring. Previous studies relying on shallow machine learning for BG detection struggled to capture the complex underlying correlations between PPG signals and BG. Our proposed deep hybrid feature neural network model, DCC-Net, achieves end-to-end BG prediction by capturing different temporal and spatial features in PPG signals. The F2M fusion module combines multiscale and multilevel features, effectively modeling the intricate nonlinear relationship between PPG signals and BG, thereby improving classification performance. We recruited 290 participants and used IPS to collect PPG signals, constructing an IPS–PPG dataset. Testing DCC-Net on the IPS–PPG dataset yielded an impressive overall classification accuracy of 0.92, demonstrating its high accuracy. Furthermore, our model showed good generalization performance on the publicly available dataset PPG–BP. The proposed approach exhibits significant potential for advancing research and development in noninvasive BG detection systems.",1558-1748,,10.1109/JSEN.2024.3373048,"National Natural Science Foundation of China(grant numbers:62172340); Natural Science Foundation of Chongqing(grant numbers:cstc2021jcyj-msxmX0041,cstc2021jcyj-msxmX0968); ",https://ieeexplore.ieee.org/stamp/stamp.jsp?arnumber=10466487,Blood glucose (BG) classification;BG detection system;infrared pulse sensor;neural network;photoplethysmography (PPG),Feature extraction;Blood;Glucose;IP networks;Biosensors;Support vector machines;Classification algorithms;Detection algorithms;Neural networks;Photoplethysmography;Diabetes,,,,34,IEEE,13-Mar-24,,,IEEE,IEEE Journals
Detection of Diabetes using Short-duration Photoplethysmography,P. Sardar; R. Gupta; J. K. Chandra,"Electrical Engineering, Applied Physics, University of Calcutta, Kolkata, India; Electrical Engineering, Applied Physics, University of Calcutta, Kolkata, India; Electrical Engg. Department, R.K.Mahato Government Engg. College, Purulia, West Bengal, India",2024 IEEE Calcutta Conference (CALCON),13-Mar-25,2024,,,1,5,"Diabetes, a chronic metabolic disorder characterized by elevated blood sugar levels, affects millions of individuals worldwide and is associated with various complications, including cardiovascular disease, neuropathy, and retinopathy. This study addresses the pressing need for reliable and accessible diabetes detection by proposing a new approach using short-duration photoplethysmography (PPG) signals. Leveraging a publicly available dataset comprising 180 normal and 39 diabetic subjects, the signal flow first performed preprocessing aimed at reducing noise and eliminating artifacts and extracting a set of features from the processed signals, capturing their complexity and variability. Total 12 entropy features were extracted from preprocessed signal and fed to a random forest classifier for training. The proposed model achieves promising results, with an accuracy of 89%, specificity of 96.62% on blind test (unseen data). Despite the underrepresentation of diabetic subjects in the dataset, the study provides valuable insights into the feasibility of noninvasive diabetes detection using PPG signals.",,979-8-3315-1666-6,10.1109/CALCON63337.2024.10914214,,https://ieeexplore.ieee.org/stamp/stamp.jsp?arnumber=10914214,Non-invasive;diabetes prediction;PPG;random forest,Training;Sensitivity;Retinopathy;Feature extraction;Photoplethysmography;Data models;Diabetes;Reliability;Random forests;Testing,,,,26,IEEE,13-Mar-25,,,IEEE,IEEE Conferences
FPGA based system for blood glucose sensing using photoplethysmography and online motion artifact correction using adaline,S. Ramasahayam; L. Arora; S. R. Chowdhury; M. Anumukonda,"International Institute of Information Technology Hyderabad, Gachibowli, Telangana, IN; IIT, Center for VLSI and Embedded Systems Technology, Hyderabad; IIT, School of Computing and Electrical Engineering, Mandi; IIT, Center for VLSI and Embedded Systems Technology, Hyderabad",2015 9th International Conference on Sensing Technology (ICST),24-Mar-16,2015,,,22,27,"This paper proposes a non invasive blood glucose sensing system using photoplethysmography (PPG). Neural network based adaptive noise cancellation (adaline) is employed to reduce the motion artifact. Also artificial neural network is used to create the predictive model which estimates the glucose levels based on PPG signals. Error in estimating glucose levels came out to be 5.48 mg/dl using ANN on MATLAB. This predictive model created by ANN has been implemented on FPGA. Error in estimating glucose levels by the ANN model implemented on FPGA, came out to be 7.23mg/dl. The results have been validated by performing Clarke error grid analysis.",2156-8073,978-1-4799-6314-0,10.1109/ICSensT.2015.7438358,,https://ieeexplore.ieee.org/stamp/stamp.jsp?arnumber=7438358,artificial neural network;glucose concentration;non-invasive;motion artifact;FPGA,Sugar;Adaptive filters;Blood;Finite impulse response filters;Biological neural networks;Field programmable gate arrays;Neurons,,8,,21,IEEE,24-Mar-16,,,IEEE,IEEE Conferences
Design and Development of Dual Point Photoplethysmography Device for Assessing Impact of Diabetes on Arterial Stiffness,A. Tayade; S. Kumar; P. Kumar; R. Bhallamudi,"Department of Mechanical Engineering, IIT Bombay, Mumbai, India; Department of Mechanical Engineering, IIT Bombay, Mumbai, India; Department of Neurosurgery, University of California, San Francisco, USA; Department of Mechanical Engineering, IIT Bombay, Mumbai, India",2024 IEEE SENSORS,17-Dec-24,2024,,,1,4,"Arterial stiffness is a condition that results from the thickening and loss of elasticity in arterial walls, commonly observed in subjects with peripheral arterial disease (PAD). The paper aims to examine the variation in arterial stiffness at two different points, point A (3 cm above the foot on the posterior tibial artery (PTA)) and point B (on the foot) to facilitate early detection and monitoring of PAD in people with diabetes. A novel non-invasive photoplethysmography (PPG) device was developed to acquire signals from the PTA using optical sensors, a microcontroller, and an analog-to-digital converter. Signals were collected from three categories: ‘Healthy and Young (< 40 years, N=20)’, ‘Age matched controls (AMC) (> 40 years, N=20)’, and 'Diabetic and Aged (> 40 years, N=20)‘. The study found consistent pulse wave patterns in healthy subjects but distinct variations in those with diabetes and PAD. In subjects with diabetes, the stiffness index increased from point A to point B. By evaluating pulse signals at multiple points, the study captured arterial property variations at point B caused by PAD, which might not have been evident in single-point analyses. This approach improves the thoroughness of the detection and emphasizes the significance of acquiring signals from multiple points to evaluate arterial health accurately.",2168-9229,979-8-3503-6351-7,10.1109/SENSORS60989.2024.10785088,,https://ieeexplore.ieee.org/stamp/stamp.jsp?arnumber=10785088,Arterial stiffness;diabetes;photoplethysmography;multi-point signal evaluation;signal processing;device development,Microcontrollers;Elasticity;Photoplethysmography;Diabetes;Optical sensors;Indexes;History;Arteries;Monitoring;Diseases,,1,,10,IEEE,17-Dec-24,,,IEEE,IEEE Conferences
A 186μW Photoplethysmography-Based Noninvasive Glucose Sensing SoC,A. Hina; W. Saadeh,"Electrical Engineering Department, Lahore University of Management Sciences, Lahore, Pakistan; Electrical Engineering Department, Lahore University of Management Sciences, Lahore, Pakistan",IEEE Sensors Journal,14-Jul-22,2022,22,14,14185,14195,"Recent trends in research and the market show high demand for frequent monitoring of glucose to estimate the blood sugar level non-invasively which can replace the conventional finger-prick glucometer for daily use. This paper presents a high precision near-infrared Photoplethysmography (PPG) based noninvasive glucose monitoring System on Chip (SoC). The proposed system implements a fully differential Analog Frontend (AFE) with nonlinear medium Gaussian support-vector-regression (NMG-SVR) for glucose estimation. The AFE design incorporates chopping which enables the reduction of the integrated input-referred current noise to 9.4pArms thus achieving a dynamic range of 115dB. The glucose prediction processor (GPP) removes noise from the PPG signal, extracts ten unique features, and estimates the blood glucose level using a trained customized NMG-SVR model that minimizes the hardware cost by 25%. The extracted features are carefully designed and implemented to ensure inter-feature dependency, which helps to reduce the overall area by more than 40%. Moreover, GPP is implemented using power and clock gating techniques to minimize both static and dynamic power consumption. The proposed SoC is realized with  $0.18~\mu \text{m}$  CMOS technology and occupies an area of 6 mm2. It dissipates a power of  $186~\mu \text{W}$  and achieves a mean absolute relative difference (mARD) of 6.9% verified on 200 subjects.",1558-1748,,10.1109/JSEN.2022.3180893,"Higher Education Commission (HEC), Pakistan(grant numbers:7982/Punjab/NRPU/R&D/HEC/2017); Syed Babar Ali Research Awards (SBARA) 2021–2022; ",https://ieeexplore.ieee.org/stamp/stamp.jsp?arnumber=9794921,Frequent glucose monitoring;diabetes;photoplethysmography (PPG);near-infrared (NIR);support vector regression (SVR),Glucose;Blood;Light emitting diodes;Diabetes;Sensors;Monitoring;Skin,,11,,57,IEEE,13-Jun-22,,,IEEE,IEEE Journals
Design and Development of a Non-Invasive Glucose Monitoring Device Using Advanced Microcontroller,S. Divya; P. Karthikeyan; M. Vaigundamoorthi; D. Ramya; M. E. M. Soudagar; R. M,"Department of Biomedical Engineering, Dr. N.G.P. Institute of Technology, Coimbatore, Tamil Nadu, India; Department of Electronics and Communication Engineering, Velammal College of Engineering and Technology, Madurai, Tamil Nadu, India; Department of Electrical and Electronics Engineering, Karpagam Academy of Higher Education, Coimbatore, Tamil Nadu, India; Department of Computer Science and Business Systems, Sri Eshwar College of Engineering, Coimbatore, Tamil Nadu, India; Department of VLSI Microelectronics, Saveetha School of Engineering, Saveetha Institute of Medical and Techinical Sciences, Chennai, Tamil Nadu, India; Department of Computer Science and Engineering, Panimalar Engineering College, Chennai, Tamil Nadu, India",2024 International Conference on Expert Clouds and Applications (ICOECA),5-Aug-24,2024,,,384,389,"Millions of individuals all over the world are living with diabetes, a chronic condition that necessitates regular monitoring of Blood Glucose Levels (BGL). The present technique for minimal invasive BGL monitoring involves taking a small blood sample and transferring it to a glucometer. However, this procedure can be uncomfortable for the patient. This research presents a method for non-invasively monitoring BGL with the help of a powerful controller called the ARM Cortex-M4. For non-invasive applications, we use photoplethysmography (PPG) signals. Using a photodiode and an infrared LED light, PPG samples are received from a finger sensor. Signal processing and feature extraction are carried out using the Gray-Level Co-occurrence Matrix (GLCM) method. To predict the BGL, two ML models are developed: one employing a Linear Regression (LR) model and the other an Artificial Neural Network (ANN) model. The experimental findings show that the ANN model is quite effective, with an R2 score of 0.986. After careful consideration, the ARM Cortex-M4 microcontroller's processing capabilities were found to be optimal for running the ANN model. The model must be fine-tuned before deployment so it can communicate with the microcontroller and provide correct inference in real time. The finger sensor simplifies PPG sample collection, and the OLED display makes it simple to view BGL.",,979-8-3503-8579-3,10.1109/ICOECA62351.2024.00075,,https://ieeexplore.ieee.org/stamp/stamp.jsp?arnumber=10612619,Glucose;Non-invasive Method;Filter;Machine Learning;Photoplethysmography;R2 Score,Strips;Microcontrollers;Artificial neural networks;Predictive models;Organic light emitting diodes;Signal processing;Glucose,,,,15,IEEE,5-Aug-24,,,IEEE,IEEE Conferences
Multivariate regression and discreminant calibration models for a novel optical non-invasive blood glucose measurement method named pulse glucometry,Y. Yamakoshi; M. Ogawa; T. Yamakoshi; T. Tamura; K. -i. Yamakoshi,"Yu.Sys Corporation, Kanazawa, Ishikawa, Japan; Yu.Sys Corporation, Ishikawa, Japan; Graduate School of Natural Science & Technology, Kanazawa University, Kanazawa, Japan; Graduate School of Science & Technology, Chiba University, Chiba, Japan; Graduate School of Natural Science & Technology, Kanazawa University, Kanazawa, Japan",2009 Annual International Conference of the IEEE Engineering in Medicine and Biology Society,13-Nov-09,2009,,,126,129,"A novel optical non-invasive in vivo blood glucose concentration (BGL) measurement technique, named ldquopulse glucometryrdquo, was combined with a kernel method; support vector machines. The total transmitted radiation intensity (Ilambda) and the cardiac-related pulsatile changes superimposed on Ilambda in human adult fingertips were measured over the wavelength range from 900 to 1700 nm using a very fast spectrophotometer, obtaining a differential optical density (DeltaODlambda) related to the blood component in the finger tissues. Subsequently, a calibration model using paired data of a family of DeltaODlambdas and the corresponding known BGLs was constructed with support vector machines (SVMs) regression instead of using calibration by a conventional primary component regression (PCR) and partial least squares regression (PLS). Secondly, SVM method was applied to make a nonlinear discriminant calibration model for ldquopulse glucometryrdquo. Our results show that the regression calibration model based on the support vector machines can provide a good regression for the 101 paired data, in which the BGLs ranged from 89.0-219 mg/dl (4.94-12.2 mmol/l). The resultant regression was evaluated by the Clarke error grid analysis and all data points fell within the clinically acceptable regions (region A: 93%, region B: 7%). The discriminant calibration model using SVMs also provided a good result for classification (accu.racy rate 84% in the best case).",1558-4615,978-1-4244-3296-7,10.1109/IEMBS.2009.5335104,,https://ieeexplore.ieee.org/stamp/stamp.jsp?arnumber=5335104,,Pulse measurements;Multivariate regression;Calibration;Blood;Sugar;Optical pulses;Support vector machines;Nonlinear optics;In vivo;Measurement techniques,"Algorithms;Blood Glucose;Calibration;Computer Simulation;Data Interpretation, Statistical;Diagnosis, Computer-Assisted;Diagnosis, Computer-Assisted;Discriminant Analysis;Equipment Design;Equipment Failure Analysis;Japan;Models, Statistical;Multivariate Analysis;Photoplethysmography;Photoplethysmography;Reproducibility of Results;Sensitivity and Specificity;Spectrum Analysis;Spectrum Analysis",5,,15,IEEE,13-Nov-09,,,IEEE,IEEE Conferences
Non-invasive Diabetes Mellitus Detection System using Machine Learning Techniques,A. Prabha; J. Yadav; A. Rani; V. Singh,"dept. Instrumentation and Control Engineering, Netaji Subhas Institute of Technology, University of Delhi, New Delhi, India; dept. Instrumentation and Control Engineering, Netaji Subhas Institute of Technology, University of Delhi, New Delhi, India; dept. Instrumentation and Control Engineering, Netaji Subhas Institute of Technology, University of Delhi, New Delhi, India; dept. Instrumentation and Control Engineering, Netaji Subhas Institute of Technology, University of Delhi, New Delhi, India","2021 11th International Conference on Cloud Computing, Data Science & Engineering (Confluence)",15-Mar-21,2021,,,948,953,"This work presents an automated diabetes mellitus detection system (DMDS), based on wrist photoplethysmography (PPG) signal and physiological parameters. The PPG signal with an average duration of 2.5 minutes is obtained using the handle Empatica E4 Wristband from 217 patients. The mel frequency cepstral coefficients (MFCC) features are extracted from 5 second segments of the PPG signal. The extracted features and physiological parameters constitute the input for machine learning (ML) systems. K-nearest neighbors (KNN) and Support Vector machine (SVM) algorithms are used for classification. 83.87% and 84.49% classification accuracy is achieved with KNN and radial basis function (RBF) Kernel SVM based DMDS respectively. Further principal component analysis is used on the input feature set to the SVM classifier which provides 7.79% improvement in the performance. The performance of the developed systems is also analysed using entropy triangle. Results reveal the effectiveness of proposed DMDS for non-invasive DM detection. The designed wrist band identifies the diabetic and pre-diabetic cases in real time on the basis of short duration PPG signal and physiological parameters.",,978-1-6654-1451-7,10.1109/Confluence51648.2021.9377138,,https://ieeexplore.ieee.org/stamp/stamp.jsp?arnumber=9377138,Diabetes Mellitus;PPG Signal;MFCC;Physical Parameters;KNN;SVM;PCA;Entropy Triangle,Support vector machines;Wrist;Machine learning;Feature extraction;Physiology;Diabetes;Mel frequency cepstral coefficient,,12,,14,IEEE,15-Mar-21,,,IEEE,IEEE Conferences
