PMID,Title,Authors,Citation,First Author,Journal/Book,Publication Year,Create Date,PMCID,NIHMS ID,DOI,Abstract
27885969,"36th International Symposium on Intensive Care and Emergency Medicine : Brussels, Belgium. 15-18 March 2016","Bateman RM, Sharpe MD, Jagger JE, Ellis CG, Solé-Violán J, López-Rodríguez M, Herrera-Ramos E, Ruíz-Hernández J, Borderías L, Horcajada J, González-Quevedo N, Rajas O, Briones M, Rodríguez de Castro F, Rodríguez Gallego C, Esen F, Orhun G, Ergin Ozcan P, Senturk E, Ugur Yilmaz C, Orhan N, Arican N, Kaya M, Kucukerden M, Giris M, Akcan U, Bilgic Gazioglu S, Tuzun E, Riff R, Naamani O, Douvdevani A, Takegawa R, Yoshida H, Hirose T, Yamamoto N, Hagiya H, Ojima M, Akeda Y, Tasaki O, Tomono K, Shimazu T, Ono S, Kubo T, Suda S, Ueno T, Ikeda T, Hirose T, Ogura H, Takahashi H, Ojima M, Kang J, Nakamura Y, Kojima T, Shimazu T, Ikeda T, Suda S, Izutani Y, Ueno T, Ono S, Taniguchi T, O M, Dinter C, Lotz J, Eilers B, Wissmann C, Lott R, Meili MM, Schuetz PS, Hawa H, Sharshir M, Aburageila M, Salahuddin N, Chantziara V, Georgiou S, Tsimogianni A, Alexandropoulos P, Vassi A, Lagiou F, Valta M, Micha G, Chinou E, Michaloudis G, Kodaira A, Ikeda T, Ono S, Ueno T, Suda S, Izutani Y, Imaizumi H, De la Torre-Prados MV, Garcia-De la Torre A, Enguix-Armada A, Puerto-Morlan A, Perez-Valero V, Garcia-Alcantara A, Bolton N, Dudziak J, Bonney S, Tridente A, Nee P, et al.",Crit Care. 2016 Apr 20;20(Suppl 2):94. doi: 10.1186/s13054-016-1208-6.,Bateman RM,Crit Care,2016,11/26/2016,PMC5493079,,10.1186/s13054-016-1208-6,
39292586,PPG based Noninvasive Blood Glucose Monitoring using Multi-view Attention and Cascaded BiLSTM Hierarchical Feature Fusion Approach,"Ali M, Li J, Fan B, Nie Z.",IEEE J Biomed Health Inform. 2024 Sep 18;PP. doi: 10.1109/JBHI.2024.3464098. Online ahead of print.,Ali M,IEEE J Biomed Health Inform,2024,9/18/2024,,,10.1109/JBHI.2024.3464098,
37289613,Noninvasive Blood Glucose Monitoring Using Spatiotemporal ECG and PPG Feature Fusion and Weight-Based Choquet Integral Multimodel Approach,"Li J, Ma J, Omisore OM, Liu Y, Tang H, Ao P, Yan Y, Wang L, Nie Z.",IEEE Trans Neural Netw Learn Syst. 2024 Oct;35(10):14491-14505. doi: 10.1109/TNNLS.2023.3279383. Epub 2024 Oct 7.,Li J,IEEE Trans Neural Netw Learn Syst,2024,6/8/2023,,,10.1109/TNNLS.2023.3279383,
35808352,Noninvasive Blood Glucose Monitoring Systems Using Near-Infrared Technology-A Review,"Hina A, Saadeh W.",Sensors (Basel). 2022 Jun 27;22(13):4855. doi: 10.3390/s22134855.,Hina A,Sensors (Basel),2022,7/9/2022,PMC9268854,,10.3390/s22134855,
39753714,Non-invasive blood glucose monitoring using PPG signals with various deep learning models and implementation using TinyML,"Zeynali M, Alipour K, Tarvirdizadeh B, Ghamari M.",Sci Rep. 2025 Jan 2;15(1):581. doi: 10.1038/s41598-024-84265-8.,Zeynali M,Sci Rep,2025,1/3/2025,PMC11698867,,10.1038/s41598-024-84265-8,
30283998,Non-invasive monitoring of blood glucose using optical methods for skin spectroscopy-opportunities and recent advances,"Delbeck S, Vahlsing T, Leonhardt S, Steiner G, Heise HM.",Anal Bioanal Chem. 2019 Jan;411(1):63-77. doi: 10.1007/s00216-018-1395-x. Epub 2018 Oct 3.,Delbeck S,Anal Bioanal Chem,2019,10/5/2018,,,10.1007/s00216-018-1395-x,
29777849,Noninvasive Diagnostic Methods for Better Screening of Peripheral Arterial Disease,"Nirala N, Periyasamy R, Kumar A.",Ann Vasc Surg. 2018 Oct;52:263-272. doi: 10.1016/j.avsg.2018.03.018. Epub 2018 May 17.,Nirala N,Ann Vasc Surg,2018,5/20/2018,,,10.1016/j.avsg.2018.03.018,
35943772,Overview of Artificial Intelligence-Driven Wearable Devices for Diabetes: Scoping Review,"Ahmed A, Aziz S, Abd-Alrazaq A, Farooq F, Sheikh J.",J Med Internet Res. 2022 Aug 9;24(8):e36010. doi: 10.2196/36010.,Ahmed A,J Med Internet Res,2022,8/9/2022,PMC9399882,,10.2196/36010,
39569675,A noninvasive blood glucose detection method with strong time adaptability based on fuzzy operator decision fusion and dynamic spectroscopy characteristics of PPG signals,"Liu R, Liu J, Huang Z, Li Q.",Anal Methods. 2024 Dec 19;17(1):26-36. doi: 10.1039/d4ay01697a.,Liu R,Anal Methods,2024,11/21/2024,,,10.1039/d4ay01697a,
35646863,Sense and Learn: Recent Advances in Wearable Sensing and Machine Learning for Blood Glucose Monitoring and Trend-Detection,"Alhaddad AY, Aly H, Gad H, Al-Ali A, Sadasivuni KK, Cabibihan JJ, Malik RA.",Front Bioeng Biotechnol. 2022 May 12;10:876672. doi: 10.3389/fbioe.2022.876672. eCollection 2022.,Alhaddad AY,Front Bioeng Biotechnol,2022,6/1/2022,PMC9135106,,10.3389/fbioe.2022.876672,
36999925,Fusion of various optimisation based feature smoothing methods for wearable and non-invasive blood glucose estimation,"Wei Y, Wing-Kuen Ling B, Chen D, Dai Y, Liu Q.",IET Syst Biol. 2023 Jun;17(3):107-120. doi: 10.1049/syb2.12063. Epub 2023 Mar 31.,Wei Y,IET Syst Biol,2023,3/31/2023,PMC10280618,,10.1049/syb2.12063,
36992029,An In-Ear PPG-Based Blood Glucose Monitor: A Proof-of-Concept Study,"Hammour G, Mandic DP.",Sensors (Basel). 2023 Mar 21;23(6):3319. doi: 10.3390/s23063319.,Hammour G,Sensors (Basel),2023,3/30/2023,PMC10057625,,10.3390/s23063319,
40168213,Improvement of Non-invasive Glucose Estimation Accuracy through Multi-wavelength PPG,"Li T, Wang Q, Lei L, An Y, Guo L, Ren L, Chen X.",IEEE J Biomed Health Inform. 2025 Apr 1;PP. doi: 10.1109/JBHI.2025.3556666. Online ahead of print.,Li T,IEEE J Biomed Health Inform,2025,4/1/2025,,,10.1109/JBHI.2025.3556666,
40277568,Diabetes: Non-Invasive Blood Glucose Monitoring Using Federated Learning with Biosensor Signals,"Chellamani N, Albelwi SA, Shanmuganathan M, Amirthalingam P, Paul A.",Biosensors (Basel). 2025 Apr 16;15(4):255. doi: 10.3390/bios15040255.,Chellamani N,Biosensors (Basel),2025,4/25/2025,PMC12024879,,10.3390/bios15040255,
35746236,Non-Invasive Blood Glucose Estimation System Based on a Neural Network with Dual-Wavelength Photoplethysmography and Bioelectrical Impedance Measuring,"Yen CT, Chen UH, Wang GC, Chen ZX.",Sensors (Basel). 2022 Jun 12;22(12):4452. doi: 10.3390/s22124452.,Yen CT,Sensors (Basel),2022,6/24/2022,PMC9229484,,10.3390/s22124452,
28665142,Targeting One-Hour Postmeal Glucose: Is It Time for a Paradigm Switch in Diabetes Management?,Ceriello A.,Diabetes Technol Ther. 2017 Sep;19(9):493-497. doi: 10.1089/dia.2017.0135. Epub 2017 Jun 30.,Ceriello A,Diabetes Technol Ther,2017,7/1/2017,,,10.1089/dia.2017.0135,
38533291,Accuracy of a Non-Invasive Home Glucose Monitor for Measurement of Blood Glucose,"Mondal H, Biri SK, Pipil N, Mondal S.",Indian J Endocrinol Metab. 2024 Jan-Feb;28(1):60-64. doi: 10.4103/ijem.ijem_36_23. Epub 2024 Feb 26.,Mondal H,Indian J Endocrinol Metab,2024,3/27/2024,PMC10962770,,10.4103/ijem.ijem_36_23,
39474992,Toe-brachial index and toe systolic blood pressure for the diagnosis of peripheral arterial disease,"Tehan PE, Mills J, Leask S, Oldmeadow C, Peterson B, Sebastian M, Chuter V.",Cochrane Database Syst Rev. 2024 Oct 30;10(10):CD013783. doi: 10.1002/14651858.CD013783.pub2.,Tehan PE,Cochrane Database Syst Rev,2024,10/30/2024,PMC11523229,,10.1002/14651858.CD013783.pub2,
37865774,Non-invasive detection of early microvascular changes in juveniles with type 1 diabetes,"Bogusz-Górna K, Polańska A, Dańczak-Pazdrowska A, Żaba R, Sumińska M, Fichna P, Kędzia A.",Cardiovasc Diabetol. 2023 Oct 21;22(1):285. doi: 10.1186/s12933-023-02031-y.,Bogusz-Górna K,Cardiovasc Diabetol,2023,10/21/2023,PMC10590527,,10.1186/s12933-023-02031-y,
29607521,Noninvasive wearable sensor for indirect glucometry,"Zilberstein G, Zilberstein R, Maor U, Righetti PG.",Electrophoresis. 2018 Sep;39(18):2344-2350. doi: 10.1002/elps.201700424. Epub 2018 Apr 30.,Zilberstein G,Electrophoresis,2018,4/3/2018,,,10.1002/elps.201700424,
36943970,"Arterial Doppler Imaging, ABI, and Plethysmography","Montemayor E, Ben Aziz M.",2023 Mar 6. In: StatPearls [Internet]. Treasure Island (FL): StatPearls Publishing; 2025 Jan–.,Montemayor EBen Aziz M,StatPearls,2025,3/6/2023,,,,
32149655,A Noninvasive Glucose Monitoring SoC Based on Single Wavelength Photoplethysmography,"Hina A, Saadeh W.",IEEE Trans Biomed Circuits Syst. 2020 Jun;14(3):504-515. doi: 10.1109/TBCAS.2020.2979514. Epub 2020 Mar 9.,Hina A,IEEE Trans Biomed Circuits Syst,2020,3/10/2020,,,10.1109/TBCAS.2020.2979514,
36917147,The Effectiveness of Wearable Devices Using Artificial Intelligence for Blood Glucose Level Forecasting or Prediction: Systematic Review,"Ahmed A, Aziz S, Abd-Alrazaq A, Farooq F, Househ M, Sheikh J.",J Med Internet Res. 2023 Mar 14;25:e40259. doi: 10.2196/40259.,Ahmed A,J Med Internet Res,2023,3/14/2023,PMC10131991,,10.2196/40259,
36088679,A non-invasive harmonic analysis to assess risk of retinopathy in type 2 diabetes mellitus,"Liao KM, Wang SH, Tsai LT, Chen YC, Wang TC, Wang GC.",J Diabetes Complications. 2022 Oct;36(10):108306. doi: 10.1016/j.jdiacomp.2022.108306. Epub 2022 Sep 7.,Liao KM,J Diabetes Complications,2022,9/11/2022,,,10.1016/j.jdiacomp.2022.108306,
21696930,Non-invasive estimate of blood glucose and blood pressure from a photoplethysmograph by means of machine learning techniques,Monte-Moreno E.,Artif Intell Med. 2011 Oct;53(2):127-38. doi: 10.1016/j.artmed.2011.05.001. Epub 2011 Jun 22.,Monte-Moreno E,Artif Intell Med,2011,6/24/2011,,,10.1016/j.artmed.2011.05.001,
36111903,Research on multi-parameter fusion non-invasive blood glucose detection method based on machine learning,"Li JJ, Qu ZP, Wang YW, Guo J.",Eur Rev Med Pharmacol Sci. 2022 Sep;26(17):6040-6049. doi: 10.26355/eurrev_202209_29618.,Li JJ,Eur Rev Med Pharmacol Sci,2022,9/16/2022,,,10.26355/eurrev_202209_29618,
38875549,Assessing Elevated Blood Glucose Levels Through Blood Glucose Evaluation and Monitoring Using Machine Learning and Wearable Photoplethysmography Sensors: Algorithm Development and Validation,"Shi B, Dhaliwal SS, Soo M, Chan C, Wong J, Lam NWC, Zhou E, Paitimusa V, Loke KY, Chin J, Chua MT, Liaw KCS, Lim AWH, Insyirah FF, Yen SC, Tay A, Ang SB.",JMIR AI. 2023 Oct 27;2:e48340. doi: 10.2196/48340.,Shi B,JMIR AI,2023,6/14/2024,PMC11041426,,10.2196/48340,
35159679,Recent Advances in Wearable Optical Sensor Automation Powered by Battery versus Skin-like Battery-Free Devices for Personal Healthcare-A Review,"Kazanskiy NL, Butt MA, Khonina SN.",Nanomaterials (Basel). 2022 Jan 21;12(3):334. doi: 10.3390/nano12030334.,Kazanskiy NL,Nanomaterials (Basel),2022,2/15/2022,PMC8838083,,10.3390/nano12030334,
37810055,A novel multipurpose device for dataset creation and on-device immediate estimation of blood glucose level from reflection ppg,"Mosaddequr K, Rahman T.",Heliyon. 2023 Sep 1;9(9):e19553. doi: 10.1016/j.heliyon.2023.e19553. eCollection 2023 Sep.,Mosaddequr K,Heliyon,2023,10/9/2023,PMC10558790,,10.1016/j.heliyon.2023.e19553,
33018135,"A Review of Photoplethysmography-based Physiological Measurement and Estimation, Part 1: Single Input Methods","Johnson MSS, Mikael Eklund J.",Annu Int Conf IEEE Eng Med Biol Soc. 2020 Jul;2020:923-927. doi: 10.1109/EMBC44109.2020.9176353.,Johnson MSS,Annu Int Conf IEEE Eng Med Biol Soc,2020,10/6/2020,,,10.1109/EMBC44109.2020.9176353,
34329866,Design of intelligent diabetes mellitus detection system using hybrid feature selection based XGBoost classifier,"Prabha A, Yadav J, Rani A, Singh V.",Comput Biol Med. 2021 Sep;136:104664. doi: 10.1016/j.compbiomed.2021.104664. Epub 2021 Jul 22.,Prabha A,Comput Biol Med,2021,7/30/2021,,,10.1016/j.compbiomed.2021.104664,
34300657,Noninvasive In Vivo Estimation of Blood-Glucose Concentration by Monte Carlo Simulation,"Haque CA, Hossain S, Kwon TH, Kim KD.",Sensors (Basel). 2021 Jul 19;21(14):4918. doi: 10.3390/s21144918.,Haque CA,Sensors (Basel),2021,7/24/2021,PMC8309922,,10.3390/s21144918,
35449869,Optimization and Evaluation of an Intelligent Short-Term Blood Glucose Prediction Model Based on Noninvasive Monitoring and Deep Learning Techniques,"Zhang Y, Gao G.",J Healthc Eng. 2022 Apr 11;2022:8956850. doi: 10.1155/2022/8956850. eCollection 2022.,Zhang Y,J Healthc Eng,2022,4/22/2022,PMC9017442,,10.1155/2022/8956850,
38444669,Non-invasive blood glucose estimation method based on the phase delay between oxy- and deoxyhemoglobin using visible and near-infrared spectroscopy,"Nakazawa T, Sekine R, Kitabayashi M, Hashimoto Y, Ienaka A, Morishita K, Fujii T, Ito M, Matsushita F.",J Biomed Opt. 2024 Mar;29(3):037001. doi: 10.1117/1.JBO.29.3.037001. Epub 2024 Mar 5.,Nakazawa T,J Biomed Opt,2024,3/6/2024,PMC10913690,,10.1117/1.JBO.29.3.037001,
35512706,Feasibility of home-based tracking of insulin resistance from vascular stiffness estimated from the photoplethysmographic finger pulse waveform,"Koppula A, Asif AR, Barra RR, Sridharan KS.",Physiol Meas. 2022 Jun 28;43(6). doi: 10.1088/1361-6579/ac6d3f.,Koppula A,Physiol Meas,2022,5/5/2022,,,10.1088/1361-6579/ac6d3f,
35458947,Machine-Learning-Based Noninvasive In Vivo Estimation of HbA1c Using Photoplethysmography Signals,"Kwon TH, Kim KD.",Sensors (Basel). 2022 Apr 12;22(8):2963. doi: 10.3390/s22082963.,Kwon TH,Sensors (Basel),2022,4/23/2022,PMC9027622,,10.3390/s22082963,
35528721,A Correlational Study on Cardiopulmonary Endurance in Male Patients with New-Onset Type 2 Diabetes,"Liu BB, Niu ZR, Jia XJ, Liu XL, Lu Q.",Diabetes Metab Syndr Obes. 2022 May 2;15:1365-1373. doi: 10.2147/DMSO.S352798. eCollection 2022.,Liu BB,Diabetes Metab Syndr Obes,2022,5/9/2022,PMC9075895,,10.2147/DMSO.S352798,
36350856,Video Based Cocktail Causal Container for Blood Pressure Classification and Blood Glucose Prediction,"Zhang C, Jovanov E, Liao H, Zhang YT, Lo B, Zhang Y, Guan C.",IEEE J Biomed Health Inform. 2023 Feb;27(2):1118-1128. doi: 10.1109/JBHI.2022.3220967. Epub 2023 Feb 3.,Zhang C,IEEE J Biomed Health Inform,2023,11/9/2022,,,10.1109/JBHI.2022.3220967,
28107204,Non-invasive blood glucose detection system based on conservation of energy method,"Zhang Y, Zhu JM, Liang YB, Chen HB, Yin SM, Chen ZC.",Physiol Meas. 2017 Feb;38(2):325-342. doi: 10.1088/1361-6579/aa50cf. Epub 2017 Jan 20.,Zhang Y,Physiol Meas,2017,1/21/2017,,,10.1088/1361-6579/aa50cf,
38194409,Multi-View Cross-Fusion Transformer Based on Kinetic Features for Non-Invasive Blood Glucose Measurement Using PPG Signal,"Chen S, Qin F, Ma X, Wei J, Zhang YT, Zhang Y, Jovanov E.",IEEE J Biomed Health Inform. 2024 Jan 9;PP. doi: 10.1109/JBHI.2024.3351867. Online ahead of print.,Chen S,IEEE J Biomed Health Inform,2024,1/9/2024,,,10.1109/JBHI.2024.3351867,
32807931,A digital biomarker of diabetes from smartphone-based vascular signals,"Avram R, Olgin JE, Kuhar P, Hughes JW, Marcus GM, Pletcher MJ, Aschbacher K, Tison GH.",Nat Med. 2020 Oct;26(10):1576-1582. doi: 10.1038/s41591-020-1010-5. Epub 2020 Aug 17.,Avram R,Nat Med,2020,8/19/2020,PMC8483886,NIHMS1628799,10.1038/s41591-020-1010-5,
37650068,Measurement of stress-induced sympathetic nervous activity using multi-wavelength PPG,"Udhayakumar R, Rahman S, Buxi D, Macefield VG, Dawood T, Mellor N, Karmakar C.",R Soc Open Sci. 2023 Aug 30;10(8):221382. doi: 10.1098/rsos.221382. eCollection 2023 Aug.,Udhayakumar R,R Soc Open Sci,2023,8/31/2023,PMC10465208,,10.1098/rsos.221382,
26406035,Research on the multiple linear regression in non-invasive blood glucose measurement,"Zhu J, Chen Z.",Biomed Mater Eng. 2015;26 Suppl 1:S447-53. doi: 10.3233/BME-151334.,Zhu J,Biomed Mater Eng,2015,9/26/2015,,,10.3233/BME-151334,
29200023,Large Artery Dysfunction in Primary Antiphospholipid Syndrome,"Osmundo GS Jr, Carvalho JF, Bortolotto LA, Viana VST, Bonfá E.",J Clin Rheumatol. 2018 Jan;24(1):14-17. doi: 10.1097/RHU.0000000000000618.,Osmundo GS Jr,J Clin Rheumatol,2018,12/5/2017,,,10.1097/RHU.0000000000000618,
39287509,Utility of photoplethysmography in detecting elevated blood glucose among non-diabetics,"Ang SB, Chua MT, Shi B, Chan SHC, Liaw CSK, Dhaliwal SS.",Singapore Med J. 2024 Sep 17. doi: 10.4103/singaporemedj.SMJ-2023-156. Online ahead of print.,Ang SB,Singapore Med J,2024,9/17/2024,,,10.4103/singaporemedj.SMJ-2023-156,
22068431,﻿﻿﻿﻿﻿﻿﻿Measuring toe pressures using a portable photoplethysmograph to detect arterial disease in high-risk patients: an overview of the literature,Bonham P.,Ostomy Wound Manage. 2011 Nov;57(11):36-44.,Bonham P,Ostomy Wound Manage,2011,11/10/2011,,,,
40293000,A Deep Sparse Capsule Network for Non-Invasive Blood Glucose Level Estimation Using a PPG Sensor,"Chellamani N, Albelwi SA, Shanmuganathan M, Amirthalingam P, Alharbi EM, Alatawi HQS, Prabahar K, Aljabri JB, Paul A.",Sensors (Basel). 2025 Mar 18;25(6):1868. doi: 10.3390/s25061868.,Chellamani N,Sensors (Basel),2025,4/28/2025,PMC11945921,,10.3390/s25061868,
37892937,Implicit HbA1c Achieving 87% Accuracy within 90 Days in Non-Invasive Fasting Blood Glucose Measurements Using Photoplethysmography,"Chu J, Chang YT, Liaw SK, Yang FL.",Bioengineering (Basel). 2023 Oct 16;10(10):1207. doi: 10.3390/bioengineering10101207.,Chu J,Bioengineering (Basel),2023,10/28/2023,PMC10604272,,10.3390/bioengineering10101207,
37129422,Pulse Power Generation Chronoamperometry as an Advanced Readout for (Bio)sensors: Application for Noninvasive Diabetes Monitoring,"Komkova MA, Eliseev AA, Kasimovskaya VS, Poyarkov AA, Eliseev AA, Karyakin AA.",Anal Chem. 2023 May 16;95(19):7528-7535. doi: 10.1021/acs.analchem.2c05746. Epub 2023 May 2.,Komkova MA,Anal Chem,2023,5/2/2023,,,10.1021/acs.analchem.2c05746,
30222001,Noninvasive Monitoring of Blood Glucose Using Color-Coded Photoplethysmographic Images of the Illuminated Fingertip Within the Visible and Near-Infrared Range: Opportunities and Questions,"Vahlsing T, Delbeck S, Leonhardt S, Heise HM.",J Diabetes Sci Technol. 2018 Nov;12(6):1169-1177. doi: 10.1177/1932296818798347. Epub 2018 Sep 15.,Vahlsing T,J Diabetes Sci Technol,2018,9/18/2018,PMC6232738,,10.1177/1932296818798347,
29368039,Assessment of Subtle Changes in Diabetes-Associated Arteriosclerosis using Photoplethysmographic Pulse Wave from Index Finger,"Hsu PC, Wu HT, Sun CK.",J Med Syst. 2018 Jan 24;42(3):43. doi: 10.1007/s10916-018-0901-1.,Hsu PC,J Med Syst,2018,1/26/2018,,,10.1007/s10916-018-0901-1,
34883817,90% Accuracy for Photoplethysmography-Based Non-Invasive Blood Glucose Prediction by Deep Learning with Cohort Arrangement and Quarterly Measured HbA1c,"Chu J, Yang WT, Lu WR, Chang YT, Hsieh TH, Yang FL.",Sensors (Basel). 2021 Nov 24;21(23):7815. doi: 10.3390/s21237815.,Chu J,Sensors (Basel),2021,12/10/2021,PMC8659475,,10.3390/s21237815,
33345614,Vascular Assessment in Patients With a Lower Limb Wound: A Correlational Study of Photoplethysmography and Laser Doppler Flowmetry Toe Pressure Techniques,"Patry J, Laurencelle L, Bélisle J, Beaumier M.",J Diabetes Sci Technol. 2022 Mar;16(2):470-477. doi: 10.1177/1932296820979973. Epub 2020 Dec 20.,Patry J,J Diabetes Sci Technol,2022,12/21/2020,PMC8861787,,10.1177/1932296820979973,
37148883,Overcoming biological barriers to improve treatment of a Staphylococcus aureus wound infection,"Papadopoulou V, Sidders AE, Lu KY, Velez AZ, Durham PG, Bui DT, Angeles-Solano M, Dayton PA, Rowe SE.",Cell Chem Biol. 2023 May 18;30(5):513-526.e5. doi: 10.1016/j.chembiol.2023.04.009. Epub 2023 May 5.,Papadopoulou V,Cell Chem Biol,2023,5/6/2023,PMC10198964,NIHMS1896262,10.1016/j.chembiol.2023.04.009,
30629956,Comparative accuracy of optical sensor-based wearable system for non-invasive measurement of blood glucose concentration,"Rodin D, Kirby M, Sedogin N, Shapiro Y, Pinhasov A, Kreinin A.",Clin Biochem. 2019 Mar;65:15-20. doi: 10.1016/j.clinbiochem.2018.12.014. Epub 2019 Jan 7.,Rodin D,Clin Biochem,2019,1/11/2019,,,10.1016/j.clinbiochem.2018.12.014,
29485624,"A new, short-recorded photoplethysmogram dataset for blood pressure monitoring in China","Liang Y, Chen Z, Liu G, Elgendi M.",Sci Data. 2018 Feb 27;5:180020. doi: 10.1038/sdata.2018.20.,Liang Y,Sci Data,2018,2/28/2018,PMC5827692,,10.1038/sdata.2018.20,
20923726,Arterial stiffness using radial arterial waveforms measured at the wrist as an indicator of diabetic control in the elderly,"Wu HT, Lee CH, Liu AB, Chung WS, Tang CJ, Sun CK, Yip HK.",IEEE Trans Biomed Eng. 2011 Feb;58(2):243-52. doi: 10.1109/TBME.2010.2084087. Epub 2010 Oct 4.,Wu HT,IEEE Trans Biomed Eng,2011,10/7/2010,,,10.1109/TBME.2010.2084087,
33628837,Brachial-Ankle Pulse Wave Velocity as a Novel Modality for Detecting Early Diabetic Nephropathy in Type 2 Diabetes Patients,"Zhang X, Bai R, Zou L, Zong J, Qin Y, Wang Y.",J Diabetes Res. 2021 Feb 9;2021:8862573. doi: 10.1155/2021/8862573. eCollection 2021.,Zhang X,J Diabetes Res,2021,2/25/2021,PMC7886592,,10.1155/2021/8862573,
25097056,A novel quantitative method for diabetic cardiac autonomic neuropathy assessment in type 1 diabetic mice,"Chon KH, Yang B, Posada-Quintero HF, Siu KL, Rolle M, Brink P, Birzgalis A, Moore LC.",J Diabetes Sci Technol. 2014 Nov;8(6):1157-67. doi: 10.1177/1932296814545669. Epub 2014 Aug 4.,Chon KH,J Diabetes Sci Technol,2014,8/7/2014,PMC4455481,,10.1177/1932296814545669,
24249120,Noninvasive evaluation of endothelial activity in healthy and diseased individuals,"Fronek A, Allison M.",Vasc Endovascular Surg. 2014 Feb;48(2):134-8. doi: 10.1177/1538574413508229. Epub 2013 Nov 17.,Fronek A,Vasc Endovascular Surg,2014,11/20/2013,,,10.1177/1538574413508229,
35444228,Deduction learning for precise noninvasive measurements of blood glucose with a dozen rounds of data for model training,"Lu WR, Yang WT, Chu J, Hsieh TH, Yang FL.",Sci Rep. 2022 Apr 20;12(1):6506. doi: 10.1038/s41598-022-10360-3.,Lu WR,Sci Rep,2022,4/21/2022,PMC9021306,,10.1038/s41598-022-10360-3,
10355865,Quantitative and qualitative progression of peripheral arterial disease by non-invasive testing,"Bird CE, Criqui MH, Fronek A, Denenberg JO, Klauber MR, Langer RD.",Vasc Med. 1999;4(1):15-21. doi: 10.1177/1358836X9900400103.,Bird CE,Vasc Med,1999,6/4/1999,,,10.1177/1358836X9900400103,
39463086,[Clinical Validation of a Prototype Smart Non-Invasive Pregnancy Glucose Monitor],"Lu H, Cheng L, Du Q, Zhang X, Sun Z, Zhu Z.",Zhongguo Yi Liao Qi Xie Za Zhi. 2024 Sep 30;48(5):539-543. doi: 10.12455/j.issn.1671-7104.240106.,Lu H,Zhongguo Yi Liao Qi Xie Za Zhi,2024,10/28/2024,,,10.12455/j.issn.1671-7104.240106,
37631768,A Comparative Analysis of Various Machine Learning Algorithms to Improve the Accuracy of HbA1c Estimation Using Wrist PPG Data,"Satter S, Kwon TH, Kim KD.",Sensors (Basel). 2023 Aug 17;23(16):7231. doi: 10.3390/s23167231.,Satter S,Sensors (Basel),2023,8/26/2023,PMC10460024,,10.3390/s23167231,
39337727,Design and Validation of a Monte Carlo Method for the Implementation of Noninvasive Wearable Devices for HbA1c Estimation Considering the Skin Effect,"Kwon TH, Hossain S, Turja MS, Kim KD.",Micromachines (Basel). 2024 Aug 24;15(9):1067. doi: 10.3390/mi15091067.,Kwon TH,Micromachines (Basel),2024,9/28/2024,PMC11434557,,10.3390/mi15091067,
11868049,A noninvasive measure of baroreflex sensitivity without blood pressure measurement,"Davies LC, Colhoun H, Coats AJ, Piepoli M, Francis DP.",Am Heart J. 2002 Mar;143(3):441-7. doi: 10.1067/mhj.2002.121263.,Davies LC,Am Heart J,2002,2/28/2002,,,10.1067/mhj.2002.121263,
39141451,A Non-Invasive Blood Glucose Detection System Based on Photoplethysmogram With Multiple Near-Infrared Sensors,"Du K, Li J, Huang Z, Song H, Zhang Y, Zhang Y, Mei Z.",IEEE J Biomed Health Inform. 2025 Apr;29(4):2496-2505. doi: 10.1109/JBHI.2024.3443317. Epub 2025 Apr 4.,Du K,IEEE J Biomed Health Inform,2025,8/14/2024,,,10.1109/JBHI.2024.3443317,
34153970,Lower Limb Dynamic Activity Significantly Reduces Foot Skin Perfusion: Exploring Data with Different Optical Sensors in Age-Grouped Healthy Adults,"Florindo M, Nuno SL, Rodrigues LM.",Skin Pharmacol Physiol. 2022;35(1):13-22. doi: 10.1159/000517906. Epub 2021 Jun 21.,Florindo M,Skin Pharmacol Physiol,2022,6/21/2021,,,10.1159/000517906,
25530952,A cross-sectional assessment to detect type 2 diabetes with endothelial and autonomic nervous system markers using a novel system,"Lewis JE, Lantigua L, Atlas SE, Lopez J, Mendez A, Goldberg S, Medici S, Konefal J, Woolger JM, Tiozzo E, Aliffe KH.",J Diabetes Metab Disord. 2014 Dec 14;13(1):118. doi: 10.1186/s40200-014-0118-x. eCollection 2014.,Lewis JE,J Diabetes Metab Disord,2014,12/23/2014,PMC4271477,,10.1186/s40200-014-0118-x,
26636974,Integrating Sphere Finger-Photoplethysmography: Preliminary Investigation towards Practical Non-Invasive Measurement of Blood Constituents,"Yamakoshi T, Lee J, Matsumura K, Yamakoshi Y, Rolfe P, Kiyohara D, Yamakoshi K.",PLoS One. 2015 Dec 4;10(12):e0143506. doi: 10.1371/journal.pone.0143506. eCollection 2015.,Yamakoshi T,PLoS One,2015,12/5/2015,PMC4670230,,10.1371/journal.pone.0143506,
39303203,Highly Sensitive Perovskite Photoplethysmography Sensor for Blood Glucose Sensing Using Machine Learning Techniques,"Zheng Y, Zhan Z, Chen Q, Chen J, Luo J, Cai J, Zhou Y, Chen K, Xie W.",Adv Sci (Weinh). 2024 Nov;11(43):e2405681. doi: 10.1002/advs.202405681. Epub 2024 Sep 20.,Zheng Y,Adv Sci (Weinh),2024,9/20/2024,PMC11578317,,10.1002/advs.202405681,
28636064,Side-scattered finger-photoplethysmography: experimental investigations toward practical noninvasive measurement of blood glucose,"Yamakoshi Y, Matsumura K, Yamakoshi T, Lee J, Rolfe P, Kato Y, Shimizu K, Yamakoshi KI.",J Biomed Opt. 2017 Jun 1;22(6):67001. doi: 10.1117/1.JBO.22.6.067001.,Yamakoshi Y,J Biomed Opt,2017,6/22/2017,,,10.1117/1.JBO.22.6.067001,
39672011,Photoplethysmography as a noninvasive surrogate for microneurography in measuring stress-induced sympathetic nervous activation - A machine learning approach,"Rahman S, Udhayakumar R, Kaplan D, McCarthy B, Dawood T, Mellor N, Senior A, Macefield VG, Buxi D, Karmakar C.",Comput Biol Med. 2025 Feb;185:109522. doi: 10.1016/j.compbiomed.2024.109522. Epub 2024 Dec 12.,Rahman S,Comput Biol Med,2025,12/13/2024,,,10.1016/j.compbiomed.2024.109522,
21165621,Laparoscopic mini-gastric bypass for type 2 diabetes: the preliminary report,"Kim Z, Hur KY.",World J Surg. 2011 Mar;35(3):631-6. doi: 10.1007/s00268-010-0909-2.,Kim Z,World J Surg,2011,12/18/2010,,,10.1007/s00268-010-0909-2,
