"Authors","Author full names","Author(s) ID","Title","Year","Source title","Volume","Issue","Art. No.","Page start","Page end","Page count","Cited by","DOI","Link","Abstract","Document Type","Publication Stage","Open Access","Source","EID"
"Abubeker K.M.; Baskar S.","Abubeker, K.M. (55823138000); Baskar, S. (56396373800)","55823138000; 56396373800","A Machine Learning Strategy for Internet-of-Things-Enabled Diabetic Prediction to Mitigate Pneumonia Risk","2022","2022 10th International Conference on Reliability, Infocom Technologies and Optimization (Trends and Future Directions), ICRITO 2022","","","","","","","4","10.1109/ICRITO56286.2022.9964842","https://www.scopus.com/inward/record.uri?eid=2-s2.0-85144597013&doi=10.1109%2fICRITO56286.2022.9964842&partnerID=40&md5=dd66bf36abf5d892a0da138223fdc364","Diabetes has been recently listed as the tenth-largest cause of mortality, accounting for 1.5 million fatalities, and it causes blindness, kidney failure, coronary artery disease, and even diabetic agony. Recent studies have shown that people with type 2 diabetes have an increased mortality risk if they are hospitalized for pneumonia. Non-invasive wearable gadgets and the Internet of Healthcare Things (IoHT) allow for more precise monitoring of blood glucose levels. Intensive care unit patients, expectant mothers, aged and bed-driven people have a constant battle to keep their blood glucose (BG) levels in check, including both hyper and hypoglycemia. Since internet-based healthcare systems heavily rely on technology to ensure adequate glucose control, the subject matters must be addressed cost-effectively. Using Photoplethysmograph and machine learning approaches, this research developed a hybrid non-invasive internet of things-based BG monitoring system to mitigate pneumonia risk. The developed IoT gadget is designed with MAX30102 and MLX90614 for measuring blood glucose and body temperature. The developed hardware, support vector machine (SVM), and k-nearest neighbors (K-NN) algorithm had deployed in Raspberry Pi 4B computer with graphical processing unit (GPU) support. A non-invasive glucose monitor that is more accurate than existing glucose monitoring technology would be a big step forward. This hybrid model offers 81.7% prediction accuracy and adaptability within the clinical laboratory precision criteria range. © 2022 IEEE.","Conference paper","Final","","Scopus","2-s2.0-85144597013"
"Neha H.; Sakib S.; Sadaf F.; Taslim Uddin Raju S.M.","Neha, Humaira (58930272300); Sakib, Sadman (57212649131); Sadaf, Farhan (57559871500); Taslim Uddin Raju, S.M. (57222044321)","58930272300; 57212649131; 57559871500; 57222044321","Mobile Application to Collect Data and Measure Blood Component Level in a Non-Invasive Way","2023","2023 26th International Conference on Computer and Information Technology, ICCIT 2023","","","","","","","1","10.1109/ICCIT60459.2023.10441186","https://www.scopus.com/inward/record.uri?eid=2-s2.0-85187339130&doi=10.1109%2fICCIT60459.2023.10441186&partnerID=40&md5=3ae673ae1e90c9599c153c516a82495d","The increasing advancement in mobile technology has led to many smartphone-based technologies being widely accepted in various research fields. In recent years, promising smartphone-based technologies have been developed for activity recognition, gait analysis, telemedicine, and fitness tracking. However, some invasive methods are used for measuring blood components (hemoglobin, glucose, bilirubin, etc.). This invasive method involves drawing blood from patients and then analyzing the blood sample. This process is painful, and the time delay between the blood collection and analysis can be a significant disadvantage. Extensive research is being conducted to introduce a noninvasive method of measuring blood components. However, these methods may be expensive and inconvenient for people with little literacy. To deal with these issues, we have developed a mobile application that any group of people can use conveniently and quickly. Furthermore, this application can collect data without causing inconvenience and output blood glucose and hemoglobin levels, allowing for real-time data monitoring. A study evaluated the system's performance, comparing invasive and noninvasive hemoglobin measurements on 15 subjects (11 male, 4 female) using this app. It was also tested on Samsung, Realme, Vivo, and Redmi phones, showing compatibility with diverse brands.  © 2023 IEEE.","Conference paper","Final","","Scopus","2-s2.0-85187339130"
"Limpiti T.; Seemavijai M.; Pongmee N.; Kanayat P.; Koseeyaporn J.; Puttarak N.","Limpiti, Tulaya (56303200900); Seemavijai, Mayravee (58759663400); Pongmee, Narutchai (58759525400); Kanayat, Pannita (58759450100); Koseeyaporn, Jeerasuda (6508193276); Puttarak, Nattakan (26649034800)","56303200900; 58759663400; 58759525400; 58759450100; 6508193276; 26649034800","Non-invasive Optical Blood Glucose Measuring System using Regression Models","2023","BMEiCON 2023 - 15th Biomedical Engineering International Conference","","","","","","","0","10.1109/BMEiCON60347.2023.10321988","https://www.scopus.com/inward/record.uri?eid=2-s2.0-85179556503&doi=10.1109%2fBMEiCON60347.2023.10321988&partnerID=40&md5=46c49c73abea9c5e6c10660e7486fcb2","Diabetes is one of the chronic diseases with an increasing number of patients every year. Therefore, blood glucose level (BGL) is an essential health information for diagnosis and management of diabetes. Commonly, the BGL is usually measured invasively by taking blood samples, which can cause pain or discomfort to the patients. Our paper aims to design and develop a low-cost, low-computational non-invasive blood glucose measuring system using optical technique. The proposed system consists of a hardware for measuring photoplethysmogram (PPG). The PPG signal is subsequently analyzed to estimate the corresponding BGL, which is sent wirelessly to be stored in a database and displayed on an Android application. The application recommends the appropriate dosage of insulin injection based on the type of users and their diets. The report of historical blood glucose levels in the database can also be generated for further medical examination.Three PPG features, namely peak-to-peak amplitude, maximum amplitude, and standard deviation of signal amplitude, have the strongest correlations to the BGL. We investigate three regression models for estimating the BGL from these PPG parameters. The robustness of the system is assessed using cross validations. The average root mean squares error (RMSE) for three-fold cross-validations are 17.38, 16.76, and 16.39 mg/dL for simple linear regression, principal component regression, and partial least squares regression, respectively. The RMSEs from leave-one-out cross validation are approximately 12 mg/dL, with partial least squares regression model having the best accuracy. Furthermore, the results from Clarke Error Grid Analysis indicate that the system can be implemented with any of the three models for practical usage.  © 2023 IEEE.","Conference paper","Final","","Scopus","2-s2.0-85179556503"
"Shaan B.; Yadav J.; Prabha A.","Shaan, Bhavya (58080680700); Yadav, Jyoti (57213104555); Prabha, Anju (57200993920)","58080680700; 57213104555; 57200993920","ML based Non-Invasive Diabetes Detection System using Pulse Decomposition Analysis of PPG Signal","2022","2022 8th International Conference on Signal Processing and Communication, ICSC 2022","","","","417","422","5","2","10.1109/ICSC56524.2022.10009195","https://www.scopus.com/inward/record.uri?eid=2-s2.0-85146946390&doi=10.1109%2fICSC56524.2022.10009195&partnerID=40&md5=bb2cee4baf0c4a87c16aa67331250965","In this paper, Pulse Decomposition Analysis (PDA) of Photoplethysmography (PPG) and physiological parameters is used to develop Non-Invasive (NI) Diabetes Detection system. For this study, dataset of 217 participants from normal, diabetes and prediabetes subjects are used. Further signals are segmented in 5sec window which is filtered using bandpass filter to remove noise. After filtration PDA features are extracted from PPG signal. A total of seven features are extracted. In addition to this physiological parameter such as age, weight and height of the participants are also used as features. For classification a matrix of (7886 times 10) is formed containing seven PPG features and three physiological parameters. Dataset is classified under three classes i.e., Diabetic, Pre-diabetic, and Normal. Two commonly known machine learning classification learning algorithm i.e., ensemble and decision Trees are used for classification. The results shows that 99.3% accuracy is obtained using ensemble tree method. The study shows feasibility of wearable device for non-invasive diabetes detection.  © 2022 IEEE.","Conference paper","Final","","Scopus","2-s2.0-85146946390"
"Reddy P.S.K.; Mahesh D.; Uday Teja C.; Janaki M.; Mannem K.","Reddy, Pulagam Sai Kumar (57895259800); Mahesh, Darapu (57895732600); Uday Teja, C. (57895023900); Janaki, Muthuluri (57895496300); Mannem, Kiran (57219120080)","57895259800; 57895732600; 57895023900; 57895496300; 57219120080","Non-Invasive Glucose Monitoring Using NIR Spectroscopy","2022","Journal of Physics: Conference Series","2325","1","012021","","","","7","10.1088/1742-6596/2325/1/012021","https://www.scopus.com/inward/record.uri?eid=2-s2.0-85138279733&doi=10.1088%2f1742-6596%2f2325%2f1%2f012021&partnerID=40&md5=9c66a7e63239c2d3eec1ccb8ef4c0512","Diabetes Mellitus (DM), a metabolic condition, can lead to major health problems if it is not adequately treated. Traditional blood glucose monitors are intrusive and give people pain and irritation. As a result, the study's goal was to find a non-invasive way to measure blood glucose. To determine blood glucose parameters, this system uses an NIR Spectroscopy-based system with a light source of wavelength 950nm. The light source illuminates the skin of the wrist, and a photodiode receiver captures the reflected beam. An Arduino UNO microcontroller receives the conditioned signal and digitalizes it. The spectrum is calculated by the Arduino board based on the subject's blood glucose levels. Pre-processing and segmenting the raw waveforms are required to obtain the peaks of the NIR spectrum and to compute the regression model. © Published under licence by IOP Publishing Ltd.","Conference paper","Final","All Open Access; Gold Open Access","Scopus","2-s2.0-85138279733"
"Chen J.-H.; Lin Z.-Q.; Sun C.-Y.","Chen, Jian-Hong (55087311900); Lin, Zhi-Qiang (57226726919); Sun, Chao-Yue (57226723116)","55087311900; 57226726919; 57226723116","Determination of New Non-Invasive Blood Glucose Detection Method Based on Spectral Decomposition; [基于谱分解的无创血糖检测新方法研究]","2021","Guang Pu Xue Yu Guang Pu Fen Xi/Spectroscopy and Spectral Analysis","41","8","","2378","2383","5","4","10.3964/j.issn.1000-0593(2021)08-2378-06","https://www.scopus.com/inward/record.uri?eid=2-s2.0-85112410253&doi=10.3964%2fj.issn.1000-0593%282021%2908-2378-06&partnerID=40&md5=61e261be9d1ad1bcdbcab69fb5eb8e6e","Diabetes is a disease of abnormal glucose metabolism that manifests as hyperglycemia. If the glucose level in the blood remains very low or very high for long periods, it could cause serious diseases including tissue damage, stroke, heart disease, blindness and kidney failure. According to the World Health Organization (WHO), currently there are around 450 million cases of diabetes in the world. With the increase in the number of diabetic patients, the demand for glucose measuring equipment has become increasingly urgent. As the currently popular invasive blood glucose measuring equipment will cause inconvenience and pain to patients and may even cause infections, it will inevitably bring psychological and physiological pressure to patients in the long term. Therefore, the realization of non-invasive blood glucose measurement has important clinical application value. Photoplethysmography(PPG) pulse wave contains abundant information about human cardiovascular physiology and pathology. This paper proposes a new method for non-invasive blood glucose detection based on spectral decomposition, aiming at the spectral information related to blood glucose concentration changes in the PPG signal that is difficult to observe in the time domain Continuous Wavelet Transform(CWT) is used to decompose the PPG signal from the corresponding scale and details in order to obtain the spectral component amplitude information related to the change of blood glucose concentration. Studies have found that there is a higher correlation between the change inthe amplitude of the PPG signal spectral components and the changes in the blood glucose concentration. Through the Oral Glucose Tolerance Test (OGTT), the detected blood glucose concentration and the obtained relevant PPG signal spectral components amplitude is modeled by partial least square regression, and the established model is evaluated. The Root Mean Square of Calibration (RMSEC) of the calibration set is 12.47 mg•dL-1, which is 0.69 mmol•L-1, and the Root Mean Square Error of Prediction (RMSEP) of the prediction set is 6.21 mg•dL-1, which is 0.35 mmol•L-1. The agreement between the predicted value of model's blood glucose concentration and the reference value is 96.00%. The results of the OGTT experiments show that the spectral decomposition method can effectively separate the vibration characteristic absorption spectra of blood glucose molecular groups, and the blood glucose spectral component modeling can minimize the impact of physiological variability and various environmental conditions. The prediction results of the model meet the national testing standards (>95%). Clark grid error analysis show that the results predicted by this method can be used for daily blood glucose monitoring of patients. © 2021, Peking University Press. All right reserved.","Article","Final","","Scopus","2-s2.0-85112410253"
"Atzmon Y.; Ishay E.B.; Hallak M.; Littman R.; Eisenkraft A.; Gabbay-Benziv R.","Atzmon, Yuval (57213265621); Ishay, Efrat Ben (57242138200); Hallak, Mordechai (7006072181); Littman, Romi (57219216465); Eisenkraft, Arik (7801316358); Gabbay-Benziv, Rinat (55247430100)","57213265621; 57242138200; 7006072181; 57219216465; 7801316358; 55247430100","Continuous maternal hemodynamics monitoring at delivery using a novel, noninvasive, wireless,ppg-based sensor","2021","Journal of Clinical Medicine","10","1","8","1","11","10","13","10.3390/jcm10010008","https://www.scopus.com/inward/record.uri?eid=2-s2.0-85113233558&doi=10.3390%2fjcm10010008&partnerID=40&md5=d5ea8a3fa5847f85a1da6c1444f983ef","Objective: To evaluate continuous monitoring of maternal hemodynamics during labor and delivery utilizing an innovative, noninvasive, reflective photoplethysmography-based device. Study design: The Biobeat Monitoring Platform includes a wearable wristwatch monitor that auto-matically samples cardiac output (CO), blood pressure (BP), stroke volume (SV), systemic vascular resistance (SVR), heart rate (HR) every 5 s and uploads all data to a smartphone-based app and to a data cloud, enabling remote patient monitoring and analysis of data. Low-risk parturients at term, carrying singletons pregnancies, were recruited at early delivery prior to the active phase. Big data analysis of the collected data was performed using the Power BI analysis tool (Microsoft). Next, data were normalized to visual presentation using Excel Data Analysis and the regression tool. Average measurements were compared before and after rupture of membranes, epidural anesthesia, fetal delivery, and placental expulsion. Results: Eighty-one parturients entered analysis. Epidural anesthesia was associated with a slight elevation in CO (5.5 vs. 5.6, L/min, 10 min before and after EA, p <0.05) attributed to a non-significant increase in both HR and SV. BP remained stable as of counter decrease in SVR (1361 vs. 1319 mmHg⋅min⋅mL−1, 10 min before and after EA, p <0.05). Fetal delivery was associated with a peak in CO after which it rapidly declined (6.0 vs. 7.2 vs. 6.1 L/min, 30 min before vs. point of delivery vs. after delivery, p <0.05). The mean BP remained stable throughout delivery with a slight increase at fetal delivery (92 vs. 95 vs. 92.1 mmHg, p <0.05), reflecting the increase in CO and decrease in SVR (1284 vs. 1112 vs. 1280 mmHg⋅min⋅mL−1,p <0.05)with delivery. Placental expulsion was associated with a second peak in CO and decrease in SVR. Conclusions: We presented a novel application of noninvasive hemodynamic maternal monitoring throughout labor and delivery for both research and clinical use. © 2020 by the authors. Licensee MDPI, Basel, Switzerland.","Article","Final","All Open Access; Gold Open Access; Green Open Access","Scopus","2-s2.0-85113233558"
"Wei Y.; Ling B.W.-K.; Liu Q.; Liu J.","Wei, Yiting (58040268000); Ling, Bingo Wing-Kuen (57210406493); Liu, Qing (56127803600); Liu, Jiaxin (57222480146)","58040268000; 57210406493; 56127803600; 57222480146","Multi-models with averaging in feature domain for non-invasive blood glucose estimation","2022","ISPCE-ASIA 2022 - IEEE International Symposium on Product Compliance Engineering - Asia 2022","","","","","","","3","10.1109/ISPCE-ASIA57917.2022.9971019","https://www.scopus.com/inward/record.uri?eid=2-s2.0-85145431843&doi=10.1109%2fISPCE-ASIA57917.2022.9971019&partnerID=40&md5=c46aa3b0e4dc58db11e71940c0cf8f13","Diabetes is a serious chronic metabolic disease. In the recent years, more and more studies focus on the use of the non-invasive methods to achieve the blood glucose estimation. More and more consumer technology enterprises focusing on human health are committed to implementing accurate and noninvasive blood glucose algorithm in their products. The near infrared spectroscopy built in the wearable devices is one of the common approaches to achieve the non-invasive blood glucose estimation. However, due to the interference from the external environment, these wearable non-invasive methods yield the low estimation accuracy. Even if it is not medical equipment, as a consumer product, the detection accuracy will also be an important indicator for consumers. To address this issue, this paper employs different models based on different ranges of the blood glucose values for performing the blood glucose estimation. First the photoplethysmograms (PPGs) are acquired and they are denoised via the bit plane singular spectrum analysis (SSA) method. Second, the features are extracted. For the data in the training set, first the features are averaged across the measurements in the feature domain via the optimization approach. Second, the random forest is employed to sort the importance of each feature. Third, the training set is divided into three subsets according to the reference blood glucose values. Fourth, the feature vectors and the corresponding blood glucose values in the same group are employed to build an individual model. Fifth, for each feature, the average of the feature values for all the measurements in the same subset is computed. For the data in the test set, first, the sum of the weighted distances between the test feature values and the average values obtained in the above is computed for each model. Here, the weights are defined based on the importance sorted by the random forest obtained in the above. The model corresponding to the smallest sum is assigned. Finally, the blood glucose value is estimated based on the corresponding model. Compared to the state of arts methods, our proposed method can effectively improve the estimation accuracy. In particular, the mean absolute relative difference (MARD) and the percentage of the data fall in the zone A of the Clarke error grid yielded by our proposed method reaches 12.19%, and 87.0588%, respectively. © 2022 IEEE.","Conference paper","Final","","Scopus","2-s2.0-85145431843"
"Ahmed A.; Aziz S.; Abd-Alrazaq A.; Farooq F.; Househ M.; Sheikh J.","Ahmed, Arfan (57224998577); Aziz, Sarah (57222136271); Abd-Alrazaq, Alaa (57208188497); Farooq, Faisal (57218843802); Househ, Mowafa (8667908000); Sheikh, Javaid (7006472076)","57224998577; 57222136271; 57208188497; 57218843802; 8667908000; 7006472076","The Effectiveness of Wearable Devices Using Artificial Intelligence for Blood Glucose Level Forecasting or Prediction: Systematic Review","2023","Journal of Medical Internet Research","25","","e40259","","","","22","10.2196/40259","https://www.scopus.com/inward/record.uri?eid=2-s2.0-85150311282&doi=10.2196%2f40259&partnerID=40&md5=485adca0d75a3178b04cfdb8f3abf5d6","Background: In 2021 alone, diabetes mellitus, a metabolic disorder primarily characterized by abnormally high blood glucose (BG) levels, affected 537 million people globally, and over 6 million deaths were reported. The use of noninvasive technologies, such as wearable devices (WDs), to regulate and monitor BG in people with diabetes is a relatively new concept and yet in its infancy. Noninvasive WDs coupled with machine learning (ML) techniques have the potential to understand and conclude meaningful information from the gathered data and provide clinically meaningful advanced analytics for the purpose of forecasting or prediction. Objective: The purpose of this study is to provide a systematic review complete with a quality assessment looking at diabetes effectiveness of using artificial intelligence (AI) in WDs for forecasting or predicting BG levels. Methods: We searched 7 of the most popular bibliographic databases. Two reviewers performed study selection and data extraction independently before cross-checking the extracted data. A narrative approach was used to synthesize the data. Quality assessment was performed using an adapted version of the Quality Assessment of Diagnostic Accuracy Studies-2 (QUADAS-2) tool. Results: From the initial 3872 studies, the features from 12 studies were reported after filtering according to our predefined inclusion criteria. The reference standard in all studies overall (n=11, 92%) was classified as low, as all ground truths were easily replicable. Since the data input to AI technology was highly standardized and there was no effect of flow or time frame on the final output, both factors were categorized in a low-risk group (n=11, 92%). It was observed that classical ML approaches were deployed by half of the studies, the most popular being ensemble-boosted trees (random forest). The most common evaluation metric used was Clarke grid error (n=7, 58%), followed by root mean square error (n=5, 42%). The wide usage of photoplethysmogram and near-infrared sensors was observed on wrist-worn devices. Conclusions: This review has provided the most extensive work to date summarizing WDs that use ML for diabetic-related BG level forecasting or prediction. Although current studies are few, this study suggests that the general quality of the studies was considered high, as revealed by the QUADAS-2 assessment tool. Further validation is needed for commercially available devices, but we envisage that WDs in general have the potential to remove the need for invasive devices completely for glucose monitoring in the not-too-distant future. © Arfan Ahmed, Sarah Aziz, Alaa Abd-alrazaq, Faisal Farooq, Mowafa Househ, Javaid Sheikh. Originally published in the Journal of Medical Internet Research (https://www.jmir.org), 14.03.2023. This is an open-access article distributed under the terms of the Creative Commons Attribution License (https://creativecommons.org/licenses/by/4.0/), which permits unrestricted use, distribution, and reproduction in any medium, provided the original work, first published in the Journal of Medical Internet Research, is properly cited. The complete bibliographic information, a link to the original publication on https://www.jmir.org/, as well as this copyright and license information must be included.","Review","Final","All Open Access; Gold Open Access; Green Open Access","Scopus","2-s2.0-85150311282"
