"Authors","Author full names","Author(s) ID","Title","Year","Source title","Volume","Issue","Art. No.","Page start","Page end","Page count","Cited by","DOI","Link","Abstract","Document Type","Publication Stage","Open Access","Source","EID"
"Johnson M.S.S.; Mikael Eklund J.","Johnson, Mizpah Selvam S. (57219007775); Mikael Eklund, J. (57224764128)","57219007775; 57224764128","A Review of Photoplethysmography-based Physiological Measurement and Estimation, Part 1: Single Input Methods","2020","Proceedings of the Annual International Conference of the IEEE Engineering in Medicine and Biology Society, EMBS","2020-July","","9176353","923","927","4","3","10.1109/EMBC44109.2020.9176353","https://www.scopus.com/inward/record.uri?eid=2-s2.0-85091032270&doi=10.1109%2fEMBC44109.2020.9176353&partnerID=40&md5=7202ac86905c7163e15304d247b278f4","Photoplethysmography is a non-invasive and easy to administer optical method used primarily to mea-sure blood oxygen saturation, but also used widely to estimate and measure various other physiological parameters. is paper reviews several physiological parameter estimations that have been done with just this waveform signal, i.e. heart rate, lipid profiling by morphological PPG analysis, blood glucose, ankle brachial pressure, and respiratory rate. Additional physiological estimations which use additional input measurements are reviewed in Part 2 of this paper. The different methods and signal processing techniques based on the principle of operation are discussed in this review. e validity of each of these optical measurement techniques are reviewed where the results were compared with the results obtained using the gold reference standards. Future research considerations for non-invasive wearable devices for physiological parameter measurements are also highlighted in this review which could be helpful for future research. © 2020 IEEE.","Conference paper","Final","","Scopus","2-s2.0-85091032270"
"Zhang Y.; Wang Z.","Zhang, Yue (56127257000); Wang, Ziliang (57201086789)","56127257000; 57201086789","Non-invasive blood glucose estimation using nearinfrared spectroscopy based on SVR","2017","Proceedings of 2017 IEEE 3rd Information Technology and Mechatronics Engineering Conference, ITOEC 2017","2017-January","","","594","598","4","11","10.1109/ITOEC.2017.8122366","https://www.scopus.com/inward/record.uri?eid=2-s2.0-85043387122&doi=10.1109%2fITOEC.2017.8122366&partnerID=40&md5=185a238d25a54430983e12762701d7dd","There is a nonlinear relation between the blood glucose and photoplethysmography(PPG) signal. In order to estimate the blood glucose from the photoplethysmography signal, this paper presents a non-invasive blood glucose estimation using Near-Infrared spectroscopy based on the Support Vector Regression(SVR). The wavelet transform algorithm is used to remove baseline drift and smooth signals. 22 parameters, including features obtained from PPG signal and some physiological and environmental parameters, are the input parameters of Support Vector Regression model. The comparison between estimated and reference values shows better accuracy than the multiple linear regression analysis method, partial least squares method. © 2017 IEEE.","Conference paper","Final","","Scopus","2-s2.0-85043387122"
"Guntha R.","Guntha, Ramesh (56866274100)","56866274100","IoT Architectures for Noninvasive Blood Glucose and Blood Pressure Monitoring","2019","Proceedings of the 2019 International Symposium on Embedded Computing and System Design, ISED 2019","","","9096233","120","124","4","10","10.1109/ISED48680.2019.9096233","https://www.scopus.com/inward/record.uri?eid=2-s2.0-85085735017&doi=10.1109%2fISED48680.2019.9096233&partnerID=40&md5=70af965b31aa0e4973f40f9f0573220d","Continuous noninvasive blood glucose (sugar) and blood pressure (BP) monitoring using Photoplethysmogram (PPG) is an important research area. As the research in this area is in the beginning stages, there is a need to preserve the raw PPG signals for further analysis and improvement of the prediction models. The popular IoT data optimization techniques such as lossy data compression, extracting and transmitting the features and discarding the raw data are not applicable in this case. Transmitting and storing the massive raw PPG signals over the IoT infrastructure presents a major research challenge. Another research challenge is to ensure high availability of wearable health monitoring IoT edge device for user interaction irrespective of the network availability. In this paper we present an Adaptive IoT model which the existing cloud and fog computing architectures along with a new hybrid computing architecture to solve these research challenges. We also present our BP and sugar monitoring system which implements this Adaptive IoT model using the cloud, fog and hybrid computing architectures. © 2019 IEEE.","Conference paper","Final","","Scopus","2-s2.0-85085735017"
"Hina A.; Saadeh W.","Hina, Aminah (56367934400); Saadeh, Wala (56027359600)","56367934400; 56027359600","A 186μW Glucose Monitoring SoC using Near-Infrared Photoplethysmography","2020","2020 IEEE Asian Solid-State Circuits Conference, A-SSCC 2020","","","9336124","","","","15","10.1109/A-SSCC48613.2020.9336124","https://www.scopus.com/inward/record.uri?eid=2-s2.0-85100946000&doi=10.1109%2fA-SSCC48613.2020.9336124&partnerID=40&md5=17bb9d3d40269dcf5166555855deab56","A glucose monitoring SoC based on near-infrared Photoplethysmography (PPG) is presented. It integrates fully differential AFE with nonlinear support-vector-machine regression (NSVMR). The AFE utilizes chopper to reduce input-referred current noise by 57%, and trans-impedance amplifier input impedance by 90%, thus allows 115dB dynamic range. The NSVMR is realized using the piecewise linear floating-point exponential, which decreases the area by 27% compared to conventional implementations. The 6mm2 SoC in 0.18um CMOS consumes 186 μW and reduces the mean absolute relative difference (mARD) by 30% verified on 200 subjects.  © 2020 IEEE.","Conference paper","Final","","Scopus","2-s2.0-85100946000"
"Altawan A.; Golchian D.; Iljas J.; Patel B.; Bazzi M.","Altawan, Anita (57194174674); Golchian, David (57194171719); Iljas, John (57202931766); Patel, Bipinchandra (57194171716); Bazzi, Mazen (57194173539)","57194174674; 57194171719; 57202931766; 57194171716; 57194173539","Upper extremity arterial testing: The diagnostic criteria for the physiologic examination","2017","Journal for Vascular Ultrasound","41","2","","71","73","2","0","10.1177/154431671704100203","https://www.scopus.com/inward/record.uri?eid=2-s2.0-85057047910&doi=10.1177%2f154431671704100203&partnerID=40&md5=4c38f3bf6470b55e38bb8e3db71482f8","Upper extremity arterial disease is relatively uncommon compared with lower extremity disease, but presents a unique diagnostic challenge for physicians and technologists. It affects approximately 5–10% of the population. The most common causes of upper extremity arterial disease are atherosclerosis and embolic disease. Some common symptoms of upper arterial disease include dysesthesia, paresthesia, pallor, cold intolerance, ulceration, pain, or weakness in one or both extremities. The vascular system plays a vital role in the delivering of nutrients and clearing metabolic waste products from the peripheral tissues and also helps maintain an individual’s systemic core temperature. In a majority of patients, the deep and superficial palmar arches provide the dominant blood supply to the hand. The arches are a continuation of the radial and ulnar arteries. These arches are typically connected in approximately 80% of patients. In order to accurately diagnose upper extremity arterial disease, a noninvasive upper extremity physiologic examination is of importance to determine treatment options for patients. The physiologic examination includes upper extremity segmental pressures known as wrist-brachial index, Doppler waveforms; digital evaluations include photoplethysmography and pressures of the digits known as the digital-brachial index. Physiologic tests are indirect examinations. The upper extremity arterial physiologic examination is always completed bilaterally in order to determine if the disease is present in one or both extremities and also assists in the diagnosis of disease severity. The vascular physiologic examination should focus on the symptoms presented by the patient during the history. However, a complete vascular examination is appropriate given the diffuse nature of the atherosclerotic disease process. © 2018, SAGE Publications Ltd. All rights reserved.","Article","Final","","Scopus","2-s2.0-85057047910"
"Gonzalez R.; Manzo A.; Cardenas E.; Herrera J.; Martinez F.; Gomis J.; Saiz J.","Gonzalez, Rodolfo (57198087299); Manzo, A. (55062265700); Cardenas, E. (55978152400); Herrera, J. (59280714500); Martinez, F. (57221973600); Gomis, J. (55977493400); Saiz, J. (7005152234)","57198087299; 55062265700; 55978152400; 59280714500; 57221973600; 55977493400; 7005152234","Evaluation of arterial properties through acceleration photoplethysmogram","2014","IFMBE Proceedings","41","","","1531","1534","3","0","10.1007/978-3-319-00846-2_378","https://www.scopus.com/inward/record.uri?eid=2-s2.0-84891285514&doi=10.1007%2f978-3-319-00846-2_378&partnerID=40&md5=0bc980bf7079770be83464920b8591d0","This work aimes to provide, that acceleration photoplethysmogram produces useful information in assessing arterial properties. The development and progression of arterial vascular disease is a multifactorial process. Risk factors for cardiovascular disease mediate their effects by altering the structure, properties and function of wall and endothelial components of the arterial blood vessels that vary between different vascular beds. Monitoring arterial vascular walls as well as risk factors such as hypertension, hypercholesterolemia and other blood biochemical profiles can potentially help to identify individuals having an increased risk of developing cardiovascular disease in adulthood. Pulse wave analysis has been shown to provide valuable information on aortic stiffness and elasticity, and it has been widely used to evaluate the vascular effects of aging, hypertension and atherosclerosis. The second derivative of the PPG or acceleration photoplethysmogram (APG) was developed as a method allowing more accurate recognition of the inflection points and easier interpretation of the original plethysmogram wave. Although obtained from the periphery of the circulation, APG provides information about both central and peripheral arterial properties. A computer based PPG analyzer was developed. With the APG signal, four separate systole waves (named a-d) and a diastole wave (named e) were obtained. A study with 40 people, 20 healthy volunteers and 20 subjects with previously diagnosed cardiovascular disease (diabetes mellitus, atherosclerosis, hypertension) was carried out. A t-tested distribution between healthy volunteers and patients showed a significant differences in calculated parameters: b/a (-0.742 vs -0.361, p <0.0001), d/a (-0.083 vs -0.482, p < 0.0001), e/a (0.182 vs 0.061, p< 0.0001), and for c/a (-0.039 vs -0.148, p < 0.005). In conclusion, APG signal has shown to be a noninvasive indicator for vascular assessments. © Springer International Publishing Switzerland 2014.","Conference paper","Final","","Scopus","2-s2.0-84891285514"
"Rajasekaran K.; Xavier A.M.; Jegan R.","Rajasekaran, K. (24475300500); Xavier, Anitha Mary (55752681300); Jegan, R. (55752024000)","24475300500; 55752681300; 55752024000","Smart technology for non invasive biomedical sensors to measure physiological parameters","2017","Biomedical Engineering: Concepts, Methodologies, Tools, and Applications","","","","749","778","29","1","10.4018/978-1-5225-3158-6.ch034","https://www.scopus.com/inward/record.uri?eid=2-s2.0-85028964810&doi=10.4018%2f978-1-5225-3158-6.ch034&partnerID=40&md5=ed16ffa5bc07ee75c53f8fa7d838428a","Communication and Information technologies are transforming our lifestyles, social interactions, and workplaces. One of the promising applications of the information and communication technology is healthcare and wellness management. Advancement in electronic health care and mobile have made doctors and patients to involve the modern healthcare system by extending the capabilities of physiological monitoring devices. Various biomedical sensors are being used to measure the physiological parameters like pulse rate, blood glucose level, blood pressure etc., Among various bio-sensor, Researchers from different field of science are particularly and increasingly interested in Photoplethysmography (PPG) signals. This chapter addresses the importance of bio sensors and its principle, significance of remote monitoring of PPG signal using Radio Frequency (RF) and design challenges in RF connectivity. Also this chapter presents a reliable low power wireless transmission mechanism of biomedical signals which works on narrow band RF frequencies. © 2018 IGI Global. All rights reserved.","Book chapter","Final","","Scopus","2-s2.0-85028964810"
"Ramasahayam S.; Arora L.; Chowdhury S.R.","Ramasahayam, Swathi (57193157190); Arora, Lavanya (56462749000); Chowdhury, Shubhajit Roy (23134687300)","57193157190; 56462749000; 23134687300","FPGA based smart system for non invasive blood glucose sensing using photoplethysmography and online correction of motion artifact","2017","Smart Sensors, Measurement and Instrumentation","22","","","1","21","20","10","10.1007/978-3-319-47319-2_1","https://www.scopus.com/inward/record.uri?eid=2-s2.0-85015244468&doi=10.1007%2f978-3-319-47319-2_1&partnerID=40&md5=81974d7e76d3bc0f6a980e557e2a8b1e","Near infrared spectroscopy has become a promising technology among others for noninvasive monitoring of blood glucose. Low cost hand held easy to use devices are becoming more and more popular for monitoring blood glucose and they are likely to become noninvasive in forthcoming years. The reliability and the calibration of these instruments could still be improved, and there is a need for carrying out more studies for improving the sensitivity of the device under different physiological conditions of metabolism, bodily fluid circulation, and blood components. This chapter deals with the design of noninvasive blood glucose sensing system using photoplethysmography (PPG) based on artificial neural networks. Neural network based adaptive noise cancellation (adaline) is employed to reduce the errors introduced due to motion artifacts. Also artificial neural network is used to create the predictive model which estimates the glucose levels based on PPG signals. Error in estimating glucose levels came out to be 5.48 mg/dl using ANN on MATLAB. This predictive model created by ANN has been implemented on field programmable gate array (FPGA). Error in estimating glucose levels by the ANN model implemented on FPGA, came out to be 7.23 mg/dl. The results have been validated by performing Clarke’s error grid analysis. © Springer International Publishing AG 2017.","Book chapter","Final","","Scopus","2-s2.0-85015244468"
"Gayathri B.; Sruthi K.; Menon K.A.U.","Gayathri, B. (57211178611); Sruthi, K. (57202309878); Menon, K. A. Unnikrishna (55515699500)","57211178611; 57202309878; 55515699500","Non-invasive blood glucose monitoring using near infrared spectroscopy","2018","Proceedings of the 2017 IEEE International Conference on Communication and Signal Processing, ICCSP 2017","2018-January","","","1139","1142","3","21","10.1109/ICCSP.2017.8286555","https://www.scopus.com/inward/record.uri?eid=2-s2.0-85046665724&doi=10.1109%2fICCSP.2017.8286555&partnerID=40&md5=036a612a0b2dd63b06fab948c971856c","Diabetes has become a grave concern which can affect anyone irrespective of their age. To prevent the uneasiness of invasive glucose monitoring system, it is desirable to develop a low cost non-invasive blood glucose monitoring system. The present work proposes the feasibility of developing such a method for the continuous monitoring of blood glucose concentration using near infrared spectroscopy. Both linear regression and polynomial regression analysis are studied for developing an enhanced algorithm for estimation of glucose concentration using the scattering property of glucose molecules and the principle of photoplethysmography. Processing of data conversion is performed with MSP430G2553 microcontroller in the integrated development environment (IDE) of Code Composer Studio (CCS). Data analysis is carried out in MATLAB from which a relation between blood glucose concentration and photoplethysmograph is derived. © 2017 IEEE.","Conference paper","Final","","Scopus","2-s2.0-85046665724"
"Delbeck S.; Vahlsing T.; Leonhardt S.; Steiner G.; Heise H.M.","Delbeck, Sven (55916023000); Vahlsing, Thorsten (25624074300); Leonhardt, Steffen (7004971042); Steiner, Gerald (56468197900); Heise, H. Michael (35368522000)","55916023000; 25624074300; 7004971042; 56468197900; 35368522000","Non-invasive monitoring of blood glucose using optical methods for skin spectroscopy—opportunities and recent advances","2019","Analytical and Bioanalytical Chemistry","411","1","","63","77","14","68","10.1007/s00216-018-1395-x","https://www.scopus.com/inward/record.uri?eid=2-s2.0-85054553944&doi=10.1007%2fs00216-018-1395-x&partnerID=40&md5=eb8864048d01268154b8700af50fd564","Diabetes mellitus is a widespread disease with greatly rising patient numbers expected in the future, not only for industrialized countries but also for regions in the developing world. There is a need for efficient therapy, which can be via self-monitoring of blood glucose levels to provide tight glycemic control for reducing the risks of severe health complications. Advancements in diabetes technology can nowadays offer different sensor approaches, even for continuous blood glucose monitoring. Non-invasive blood glucose assays have been promised for many years and various vibrational spectroscopy-based methods of the skin are candidates for achieving this goal. Due to the small spectral signatures of the glucose hidden among a largely variable background, the largest signal-to-noise ratios and multivariate calibration are essential to provide the method applicability for self-monitoring of blood glucose. Besides multiparameter approaches, recently presented devices based on photoplethysmography with wavelengths in the visible and near-infrared range are evaluated for their potential of providing reliable blood glucose concentration predictions. [Figure not available: see fulltext.]. © 2018, Springer-Verlag GmbH Germany, part of Springer Nature.","Review","Final","","Scopus","2-s2.0-85054553944"
"Nirala N.; Periyasamy R.; Kumar A.","Nirala, Neelamshobha (57202773889); Periyasamy, R. (23991096300); Kumar, Awanish (18437170100)","57202773889; 23991096300; 18437170100","Study of skin flow motion pattern using photoplethysmogram","2020","International Journal of Advanced Intelligence Paradigms","16","3-4","","241","264","23","3","10.1504/IJAIP.2020.107525","https://www.scopus.com/inward/record.uri?eid=2-s2.0-85086047652&doi=10.1504%2fIJAIP.2020.107525&partnerID=40&md5=856a03372c4d55b310db6ed12e152de9","Microcirculatory dysfunction is related to many diseases and occurs long before their clinical manifestation. We used wavelet transform to study the microcirculatory regulatory mechanism in three different groups (18-diabetic, 8-peripheral arterial disease (PAD) and 14 healthy controls) using toe photoplethysmogram (PPG) and 11 different features were derived. Compared to healthy subjects we obtained a significant decrease in the neurogenic (VNe: 286.41 vs. 125.29 (a. u), p-value = 0.000), myogenic (VMe: 281.55 vs. 29.02, p-value = 0.000) and respiratory activity (VRe: 37.68 vs. 9.35, p-value = 0.022) in the diabetic group and significant increase in the cardiac activity (VCe: 19.69 vs. 33.89, p-value = 0.007) in PAD group. Result of linear multiple regressions analysis showed a significant negative association of age and BMI with myogenic activity (p-value = 0.002, r-value = 0.173) and neurogenic activity (p-value = 0.036, r-value = 0.375) respectively. Our study showed that PPG signal can be used as a non-invasive tool for studying the vasomotion impairment in the diabetic patient during resting condition. Copyright © 2020 Inderscience Enterprises Ltd.","Article","Final","","Scopus","2-s2.0-85086047652"
"Osmundo G.S.; Carvalho J.F.; Bortolotto L.A.; Viana V.S.T.; Bonfá E.","Osmundo, Gilmar S. (57189266294); Carvalho, Jozélio Freire (8103240600); Bortolotto, Luiz A. (6603919146); Viana, Vilma S.T. (6604057781); Bonfá, Eloisa (7004486222)","57189266294; 8103240600; 6603919146; 6604057781; 7004486222","Large Artery Dysfunction in Primary Antiphospholipid Syndrome","2018","Journal of Clinical Rheumatology","24","1","","14","17","3","1","10.1097/RHU.0000000000000618","https://www.scopus.com/inward/record.uri?eid=2-s2.0-85040182151&doi=10.1097%2fRHU.0000000000000618&partnerID=40&md5=9bf3f9e364292518ecebeb23eb5dc821","Objective The aim of this study was to assess the arterial distensibility of large vessels and changes in microvasculature in primary antiphospholipid syndrome. Methods Twenty-two antiphospholipid syndrome (APL) patients and 66 age-, sex-, height-, and blood pressure-matched controls were evaluated. Second derivative of the finger photoplethysmogram (SDPTG) was used as a noninvasive method to evaluate the pulse wave. The b/a and d/a indices, which reflect, respectively, large-vessel and small-vessel properties, were calculated from the SDPTG waveform components. Vascular age index was also determined. Results Arterial thrombosis occurred in 59.1% (13/22) of APL patients, with a predominance of stroke episodes (61.5%). Venous thromboembolism was observed in 36.4% (all deep venous thrombosis), and obstetric complications in 36.4%. Frequency of diabetes mellitus, smoking, and dyslipidemia was comparable in APL patients and control subjects (P > 0.05). Concerning plethysmography findings, b/a ratio was higher in patients than in control subjects (-0.44 ± 0.16 vs.-0.54 ± 0.18, P = 0.034), whereas d/a ratio (-0.30 ± 0.16 vs.-0.31 ± 0.18, P = 0.83) was comparable. Moreover, SDPTG (-0.16 ± 0.35 vs.-0.30 ± 0.38, P = 0.16) and vascular age index values (53.5 ± 11.6 vs. 51.8 ± 16.1, P = 0.65) were alike in both groups. Regarding disease-related factors, patients with arterial and venous thrombosis had similar b/a, d/a, and vascular age indices (P = 0.95; P = 0.06; P = 0.12, respectively). Conclusions The higher b/a ratio in APL patients suggests decreased distensibility of large arteries and may be why APL patients are at higher risk for cardiovascular events. The d/a ratio, that is considered a marker of small vessel vascular resistance, was not different than controls. Further studies are needed to evaluate vascular factors that predispose APL patients to atherosclerotic events. © Wolters Kluwer Health, Inc. All rights reserved.","Article","Final","","Scopus","2-s2.0-85040182151"
"Zhang Y.; Wang Z.; Xiao Z.","Zhang, Yue (56127257000); Wang, Ziliang (57201086789); Xiao, Zhibo (59826021100)","56127257000; 57201086789; 59826021100","Non-invasive blood glucose detection using NIR based on GA and SVR","2018","International Conference on Biological Information and Biomedical Engineering, BIBE 2018","","","","105","108","3","2","","https://www.scopus.com/inward/record.uri?eid=2-s2.0-85099458850&partnerID=40&md5=8159af1f7724c4c7bee67b677176aad4","Between the human blood glucose with photoplethysmography (PPG) signal, there is a nonlinear and complex relation. For the purpose of measuring the human blood glucose level (BGL) from PPG signal, in this paper, we propose one non-invasive blood glucose detection method using NIR based on Genetic Algorithm (GA) and Support Vector Regres-sion (SVR). During data preprocessing, we use the wavelet transform algorithm to smooth the PPG signal and eliminate baseline drift. 23-dimensional parameters, including some physiological and environmental parameters and features calculated from PPG signal, compose the feature matrix. Genetic Algorithm is used for feature selection. Selected pa-rameters are used for SVR model training. On the test set, we used the method based on GA and SVR to obtain a 95.05% correlation coefficient, 1.74% higher than the method using SVR only. © VDE VERLAG GMBH - Berlin - Offenbach.","Conference paper","Final","","Scopus","2-s2.0-85099458850"
