"Authors","Author full names","Author(s) ID","Title","Year","Source title","Volume","Issue","Art. No.","Page start","Page end","Page count","Cited by","DOI","Link","Abstract","Document Type","Publication Stage","Open Access","Source","EID"
"Chen Y.; Yang X.; Song R.; Liu X.; Zhang J.","Chen, Yawei (57217147654); Yang, Xuezhi (7406505132); Song, Rencheng (54893870700); Liu, Xuenan (57202917714); Zhang, Jie (57417164300)","57217147654; 7406505132; 54893870700; 57202917714; 57417164300","Predicting Arterial Stiffness from Single-Channel Photoplethysmography Signal: A Feature Interaction-Based Approach","2024","IEEE Journal of Biomedical and Health Informatics","28","7","","3928","3941","13","4","10.1109/JBHI.2024.3383234","https://www.scopus.com/inward/record.uri?eid=2-s2.0-85189369581&doi=10.1109%2fJBHI.2024.3383234&partnerID=40&md5=7f48ec2b9e1ee994aa3bf16e3d088565","Arterial stiffness (AS) serves as a crucial indicator of arterial elasticity and function, typically requiring expensive equipment for detection. Given the strong correlation between AS and various photoplethysmography (PPG) features, PPG emerges as a convenient method for assessing AS. However, the limitations of independent PPG features hinder detection accuracy. This study introduces a feature selection method leveraging the interactive relationships between features to enhance the accuracy of predicting AS from a single-channel PPG signal. Initially, an adaptive signal interception method was employed to capture high-quality signal fragments from PPG sequences. 58 PPG features, deemed to have potential contributions to AS estimation, were extracted and analyzed. Subsequently, the interaction factor (IF) was introduced to redefine the interaction and redundancy between features. A feature selection algorithm (IFFS) based on the IF was then proposed, resulting in a combination of interactive features. Finally, the Xgboost model is utilized to estimate AS from the selected features set. The proposed approach is evaluated on datasets of 268 male and 124 female subjects, respectively. The results of AS estimation indicate that IFFS yields interacting features from numerous sources, rejects redundant ones, and enhances the association. The interaction features combined with the Xgboost model resulted in an MAE of 122.42 and 142.12 cm/sec, an SDE of 88.16 and 102.56 cm/sec, and a PCC of 0.88 and 0.85 for the male and female groups, respectively. The findings of this study suggest that the stated method improves the accuracy of predicting AS from single-channel PPG, which can be used as a non-invasive and cost-effective screening tool for atherosclerosis.  © 2013 IEEE.","Article","Final","","Scopus","2-s2.0-85189369581"
"Alghlayini S.; Al-Betar M.A.; Atef M.","Alghlayini, Saifeddin (57215612010); Al-Betar, Mohammed Azmi (57202908939); Atef, Mohamed (25960546300)","57215612010; 57202908939; 25960546300","Enhancing Non-Invasive Blood Glucose Prediction from Photoplethysmography Signals via Heart Rate Variability-Based Features Selection Using Metaheuristic Algorithms","2025","Algorithms","18","2","95","","","","0","10.3390/a18020095","https://www.scopus.com/inward/record.uri?eid=2-s2.0-85218627370&doi=10.3390%2fa18020095&partnerID=40&md5=97c66bdefb68402ec7b023f3ee6fc2b3","Diabetes requires effective monitoring of the blood glucose level (BGL), traditionally achieved through invasive methods. This study addresses the non-invasive estimation of BGL by utilizing heart rate variability (HRV) features extracted from photoplethysmography (PPG) signals. A systematic feature selection methodology was developed employing advanced metaheuristic algorithms, specifically the Improved Dragonfly Algorithm (IDA), Binary Grey Wolf Optimizer (bGWO), Binary Harris Hawks Optimizer (BHHO), and Genetic Algorithm (GA). These algorithms were integrated with machine learning (ML) models, including Random Forest (RF), Extra Trees Regressor (ETR), and Light Gradient Boosting Machine (LightGBM), to enhance predictive accuracy and optimize feature selection. The IDA-LightGBM combination exhibited superior performance, achieving a mean absolute error (MAE) of 13.17 mg/dL, a root mean square error (RMSE) of 15.36 mg/dL, and 94.74% of predictions falling within the clinically acceptable Clarke error grid (CEG) zone A, with none in dangerous zones. This research underscores the efficiency of utilizing HRV and PPG for non-invasive glucose monitoring, demonstrating the effectiveness of integrating metaheuristic and ML approaches for enhanced diabetes monitoring. © 2025 by the authors.","Article","Final","All Open Access; Gold Open Access","Scopus","2-s2.0-85218627370"
"Saha S.; Saha U.; Saha S.; Fattah S.A.","Saha, Sawradip (57899910700); Saha, Utsab (57899717400); Saha, Sudipta (58900798500); Fattah, Shaikh Anowarul (36550158900)","57899910700; 57899717400; 58900798500; 36550158900","PPG-Based Feature Extraction for Type II Diabetes Prediction: A Machine Learning Approach","2024","2024 2nd International Conference on Computer, Communication and Control, IC4 2024","","","","","","","2","10.1109/IC457434.2024.10486372","https://www.scopus.com/inward/record.uri?eid=2-s2.0-85190559842&doi=10.1109%2fIC457434.2024.10486372&partnerID=40&md5=e42daee7c21b2d1c4dc082b38239b41a","The timely and precise diagnosis of diabetes holds paramount importance for efficient management and prevention of associated complications. While conventional diagnostic methodologies remain reliable, they are often invasive, resource-intensive, and time-consuming. This study endeavors to present a non-invasive methodology for diabetes detection through the utilization of Photoplethysmogram (PPG) signals. A diverse array of features is meticulously extracted from the PPG data, encompassing Spectral entropy, Shannon energy, and various time-frequency domain features. The importance of each feature in diabetes prediction is assessed through machine learning techniques like Random Forest and extreme gradient boosting. Employing these features, the PPG signals are effectively classified into diabetes (type II) or normal categories using multiple machine-learning models. Through extensive experimentation, it is found that the proposed method outperforms the recent studies in a publicly available dataset. The results demonstrate high accuracy and robustness across different feature subsets, showcasing substantial promise for real-world applications in non-invasive diabetes detection.  © 2024 IEEE.","Conference paper","Final","","Scopus","2-s2.0-85190559842"
"Højlund J.; Petersen D.R.; Agerskov M.; Foss N.B.","Højlund, Jakob (55372723500); Petersen, David René (58115292600); Agerskov, Marianne (56916006900); Foss, Nicolai Bang (7005282195)","55372723500; 58115292600; 56916006900; 7005282195","“The peripheral perfusion index discriminates haemodynamic responses to induction of general anaesthesia”","2023","Journal of Clinical Monitoring and Computing","37","6","","1533","1540","7","2","10.1007/s10877-023-01035-z","https://www.scopus.com/inward/record.uri?eid=2-s2.0-85161370035&doi=10.1007%2fs10877-023-01035-z&partnerID=40&md5=8c0db4b2d5ea7dbdab0993e4b167fd29","Induction of general anaesthesia is often accompanied by hypotension. Standard haemodynamic monitoring during anaesthesia relies on intermittent blood pressure and heart rate. Continuous monitoring systemic blood pressure requires invasive or advanced modalities creating a barrier for obtaining important information of the circulation. The Peripheral Perfusion Index (PPI) is obtained non-invasively and continuously by standard photoplethysmography. We hypothesized that different patterns of changes in systemic haemodynamics during induction of general anaesthesia would be reflected in the PPI. Continuous values of PPI, stroke volume (SV), cardiac output (CO), and mean arterial pressure (MAP) were evaluated in 107 patients by either minimally invasive or non-invasive means in a mixed population of surgical patients. 2 min after induction of general anaesthesia relative changes of SV, CO, and MAP was compared to the relative changes of PPI. After induction total cohort mean(± st.dev.) MAP, SV, and CO decreased to 65(± 16)%, 74(± 18)%, and 63(± 16)% of baseline values. In the 38 patients where PPI decreased MAP was 57(± 14)%, SV was 63(± 18)%, and CO was 55(± 18)% of baseline values 2 min after induction. In the 69 patients where PPI increased the corresponding values were MAP 70(± 15)%, SV 80(± 16)%, and CO 68(± 17)% (all differences: p < 0,001). During induction of general anaesthesia changes in PPI discriminated between the degrees of reduction in blood pressure and algorithm derived cardiac stroke volume and -output. As such, the PPI has potential to be a simple and non-invasive indicator of the degree of post-induction haemodynamic changes. © 2023, The Author(s).","Article","Final","All Open Access; Green Open Access; Hybrid Gold Open Access","Scopus","2-s2.0-85161370035"
"Haque C.A.; Hossain S.; Kwon T.-H.; Kim H.; Kim K.-D.","Haque, Chowdhury Azimul (57208397367); Hossain, Shifat (36910252400); Kwon, Tae-Ho (57191905374); Kim, Hyoungkeun (57219916039); Kim, Ki-Doo (26221772100)","57208397367; 36910252400; 57191905374; 57219916039; 26221772100","Noninvasive In-Vivo Estimation of Blood-Glucose Concentration Using Beer-Lambert-Based Model","2023","Journal of Korean Institute of Communications and Information Sciences","48","7","","852","867","15","0","10.7840/kics.2023.48.7.852","https://www.scopus.com/inward/record.uri?eid=2-s2.0-85189337943&doi=10.7840%2fkics.2023.48.7.852&partnerID=40&md5=4a2679410f9109041707de67c544f082","Noninvasive measurement of blood-glucose concentration can reduce both pain and complications associated with piercing the human fingertip to collect blood. Photoplethysmography (PPG) is a helpful technique that can be used to measure blood-glucose concentration without a blood sample. To facilitate such noninvasive in-vivo estimation, we propose a model based on the Beer-Lambert law for measuring blood-glucose concentration using the PPG signal. Notably, only two wavelengths are used. First, the oxygen saturation (SpO2) is estimated from the ratio of absorbance at two wavelengths, then another absorbance ratio is presented, and the blood-glucose concentration is estimated by substituting the SpO2 estimated earlier to this ratio. The PPG signals from 40 subjects were collected along with their reference blood-glucose concentrations and SpO2 values. The PPG-based blood-glucose concentrations are then calculated using mathematical equations derived from the Beer-Lambert law. A supervised machine learning model, XGBoost, is applied to calibrate the estimation model with the reference values measured using a commercial device; according to our experimental results, the Pearson correlation coefficient (Pearson’s r) value is 0.85. The proposed model based on the Beer-Lambert law thus provides a method for in-vivo estimation of blood glucose in daily applications. © 2023, Korean Institute of Communications and Information Sciences. All rights reserved.","Article","Final","","Scopus","2-s2.0-85189337943"
"Sathish D.; Poojary S.S.; Shetty S.; Acharya P.H.; Kabekody S.","Sathish, Dayakshini (57190135936); Poojary, Souhardha S. (58805764100); Shetty, Samarth (58805709000); Acharya, Preethesh H. (58805821100); Kabekody, Sathish (58506373800)","57190135936; 58805764100; 58805709000; 58805821100; 58506373800","Non-invasive Diabetes Detection System Using Photoplethysmogram Signals","2024","Lecture Notes in Networks and Systems","796","","","457","467","10","1","10.1007/978-981-99-6906-7_39","https://www.scopus.com/inward/record.uri?eid=2-s2.0-85181976866&doi=10.1007%2f978-981-99-6906-7_39&partnerID=40&md5=8565a65c81f8bcd9d00408937bda421b","Diabetes Mellitus (DM) is a chronic condition, where the body is unable to control blood sugar levels. In this paper, a non-invasive method to classify diabetic and non-diabetic cases is discussed. The collection of blood samples from patients by puncturing their fingers causes discomfort, pain, and infection, which are serious drawbacks of commercially available invasive blood glucose level monitoring systems. A novel non-invasive device for classifying blood sugar level is developed using a Near-Infrared sensor (NIR). Photoplethysmogram (PPG) signals, which are sensitive to blood glucose levels, are acquired using NIR sensors. ANOVA statistical analysis is used to identify significant features from the PPG signal. Quadratic SVM provided better results for features such as first derivative crest, time of inflection, and age in classifying the diabetic and non-diabetic subjects. Results from real-time PPG signals are compared with features taken from a diabetes dataset from Kaggle. The results showed that proposed PPG signal analysis method performed better. © The Author(s), under exclusive license to Springer Nature Singapore Pte Ltd 2024.","Conference paper","Final","","Scopus","2-s2.0-85181976866"
"khan M.; Kumar Singh B.; Nirala N.","khan, Muzaffar (58479789400); Kumar Singh, Bikesh (55480042200); Nirala, Neelamshobha (57202773889)","58479789400; 55480042200; 57202773889","Expert diagnostic system for detection of hypertension and diabetes mellitus using discrete wavelet decomposition of photoplethysmogram signal and machine learning technique","2023","Medicine in Novel Technology and Devices","19","","100251","","","","7","10.1016/j.medntd.2023.100251","https://www.scopus.com/inward/record.uri?eid=2-s2.0-85164356332&doi=10.1016%2fj.medntd.2023.100251&partnerID=40&md5=cb2553047d8578448919ead1d3fc1ca2","Hypertension is a leading risk factor for cardiovascular disease (CVD) and the overlap of diabetes mellitus (DM) with hypertension can lead to severe complications. There is a need for early diagnosis and risk stratification to implement an overall risk management strategy. Presently, the conventional method is not suitable for large-scale screening. The primary aim of this study is to develop an automated diagnostic system that uses Photoplethysmogram (PPG) signals for the non-invasive diagnosis of hypertension and DM-II. The proposed model uses a statistical feature extracted by decomposing the PPG signal up to level 11 into a sub-band using Discrete wavelet transform (DWT), and a variety of classifiers are used for the classification of hypertension and detection of DM-II patients. Three feature selection techniques used are Spearman correlation, ReliefF and Minimum Redundancy Maximum Relevance (mRMR) to select 20 top features out of 130 features using correlation with systole blood pressure (SBP), diastole blood pressure (DBP) values and D-II. The highest accuracy attained by the Adaptive neural fuzzy system (ANFIS) for classification categories such as normal (NT) vs prehypertension(PHT), NT vs. hypertension type 1 (HT-I), NT vs hypertension type 2 (HT-II) in terms of F1 score are 92.%, 98.5%, 98.3% (SBP) and 83.1%, 95.6%, 86.8% (DBP),respectively. The accuracy achieved by the adaptive-network-based fuzzy inference system (ANFIS) for the classification of normal (non-diabetic) vs. diabetic patients is 99.1%. The hybrid learning algorithm-based classifier achieved higher accuracy for hypertension risk stratification as compared to the hard computing classifier, which requires parameter tuning and DWT decomposition is robust to the noisy signal, overcoming the limitation of the morphological feature-based model. © 2023 The Authors","Article","Final","All Open Access; Gold Open Access","Scopus","2-s2.0-85164356332"
"Mosaddequr K.; Rahman T.","Mosaddequr, Kazi (58569922700); Rahman, Tanzilur (56581345600)","58569922700; 56581345600","A novel multipurpose device for dataset creation and on-device immediate estimation of blood glucose level from reflection ppg","2023","Heliyon","9","9","e19553","","","","3","10.1016/j.heliyon.2023.e19553","https://www.scopus.com/inward/record.uri?eid=2-s2.0-85170431311&doi=10.1016%2fj.heliyon.2023.e19553&partnerID=40&md5=5f93d2f87cea8297e46bfa168ca8a3ee","We propose a completely non-invasive and highly accurate portable blood glucose estimator, which is simple hardware that anyone, regardless of their prior experience or knowledge, can use to obtain an immediate reading of their blood sugar level. Glucose levels can be monitored in real time and displayed on the device thanks to its infrared LED light source, sensor with built-in amplification unit, processing unit with blood glucose regression model, power management unit for autonomous operation, and display. The device was initially used to create a dataset of photoplethysmography (PPG) signals collected from the fingertip of 50 subjects. The extracted signal features were correlated with the subject's glucose level, which was measured at the same time using a commercial glucometer, and several regression models were constructed. The models were evaluated using signals from up to 110 subjects across three datasets, and the most optimized model was implemented in the device to predict the subject's blood glucose level solely based on PPG in real-time. The device with the built-in model has been subjected to extensive testing to gauge its efficacy. The device's clinical accuracy is encouraging. The pricey strips and needles that must be purchased along with the hardware in the conventional method will no longer be necessary with this device. © 2023 The Authors","Article","Final","All Open Access; Gold Open Access; Green Open Access","Scopus","2-s2.0-85170431311"
"Nakazawa T.; Sekine R.; Kitabayashi M.; Hashimoto Y.; Ienaka A.; Morishita K.; Fujii T.; Ito M.; Matsushita F.","Nakazawa, Tomoya (58927848700); Sekine, Rui (57190960381); Kitabayashi, Masato (58927585400); Hashimoto, Yu (53863551300); Ienaka, Anna (58927524000); Morishita, Keiji (58927648900); Fujii, Takeo (58927848900); Ito, Masaki (58927918300); Matsushita, Fumie (58927918400)","58927848700; 57190960381; 58927585400; 53863551300; 58927524000; 58927648900; 58927848900; 58927918300; 58927918400","Non-invasive blood glucose estimation method based on the phase delay between oxy- and deoxyhemoglobin using visible and near-infrared spectroscopy","2024","Journal of Biomedical Optics","29","3","037001","","","","7","10.1117/1.JBO.29.3.037001","https://www.scopus.com/inward/record.uri?eid=2-s2.0-85187202445&doi=10.1117%2f1.JBO.29.3.037001&partnerID=40&md5=6256b5b5bc0eb773fc269f80e7b855bc","Significance: Many researchers have attempted to estimate blood glucose levels (BGLs) noninvasively using near-infrared (NIR) spectroscopy. However, the optical absorption change induced by blood glucose is weak in the NIR region and often masked by interference from other components such as water and hemoglobin. Aim: Instead of using direct optical absorption by glucose, this study proposes an index calculated from oxy- and deoxyhemoglobin signals that shows a good correlation with BGLs while using conventional visible and NIR spectroscopy. Approach: The metabolic index, which is based on tissue oxygen consumption, was derived through analytical methods and further verified and reproduced in a series of glucose challenge experiments. Blood glucose estimation units were prototyped by utilizing commercially available smart devices. Results: Our experimental results showed that the phase delay between the oxy- and deoxyhemoglobin signals in near-infrared spectroscopy correlates with BGL measured by a conventional continuous glucose monitor. The proposed method was also confirmed to work well with visible spectroscopy systems based on smartphone cameras. The proposed method also demonstrated excellent repeatability in results from a total of 19 oral challenge tests. Conclusions: This study demonstrated the feasibility of non-invasive glucose monitoring using existing photoplethysmography sensors for pulse oximeters and smartwatches. Evaluating the proposed method in diabetic or unhealthy individuals may serve to further increase its practicality. © 2024 SPIE. All rights reserved.","Article","Final","All Open Access; Gold Open Access","Scopus","2-s2.0-85187202445"
"Chu J.; Chang Y.-T.; Liaw S.-K.; Yang F.-L.","Chu, Justin (57350793000); Chang, Yao-Ting (57222600815); Liaw, Shien-Kuei (25646246200); Yang, Fu-Liang (59132985100)","57350793000; 57222600815; 25646246200; 59132985100","Implicit HbA1c Achieving 87% Accuracy within 90 Days in Non-Invasive Fasting Blood Glucose Measurements Using Photoplethysmography","2023","Bioengineering","10","10","1207","","","","1","10.3390/bioengineering10101207","https://www.scopus.com/inward/record.uri?eid=2-s2.0-85175174021&doi=10.3390%2fbioengineering10101207&partnerID=40&md5=a357590e379f5b61b982b60ea233cf53","To reduce the error induced by overfitting or underfitting in predicting non-invasive fasting blood glucose (NIBG) levels using photoplethysmography (PPG) data alone, we previously demonstrated that incorporating HbA1c led to a notable 10% improvement in NIBG prediction accuracy (the ratio in zone A of Clarke’s error grid). However, this enhancement came at the cost of requiring an additional HbA1c measurement, thus being unfriendly to users. In this study, the enhanced HbA1c NIBG deep learning model (blood glucose level predicted from PPG and HbA1c) was trained with 1494 measurements, and we replaced the HbA1c measurement (explicit HbA1c) with “implicit HbA1c” which is reversely derived from pretested PPG and finger-pricked blood glucose levels. The implicit HbA1c is then evaluated across intervals up to 90 days since the pretest, achieving an impressive 87% accuracy, while the remaining 13% falls near the CEG zone A boundary. The implicit HbA1c approach exhibits a remarkable 16% improvement over the explicit HbA1c method by covering personal correction items automatically. This improvement not only refines the accuracy of the model but also enhances the practicality of the previously proposed model that relied on an HbA1c input. The nonparametric Wilcoxon paired test conducted on the percentage error of implicit and explicit HbA1c prediction results reveals a substantial difference, with a p-value of 2.75 × 10–7. © 2023 by the authors.","Article","Final","All Open Access; Gold Open Access; Green Open Access","Scopus","2-s2.0-85175174021"
"Zhang X.; Xu Y.; Li Y.; Shan J.; Hu T.; Gao L.; Sun Y.; Chen M.; Zhao X.; Ma Z.","Zhang, Xiaoyu (57208712920); Xu, Yang (57188969371); Li, Yunlong (57899409800); Shan, Jiangyi (57964247100); Hu, Tianjiao (57964247000); Gao, Lisheng (57218618612); Sun, Yining (55755199000); Chen, Mingwei (57209988671); Zhao, Xiaotong (56335439000); Ma, Zuchang (36976141400)","57208712920; 57188969371; 57899409800; 57964247100; 57964247000; 57218618612; 55755199000; 57209988671; 56335439000; 36976141400","Convenient prediction of TcPO2 level using machine learning techniques with the PPG signal's characteristic features","2023","Biomedical Signal Processing and Control","85","","105088","","","","1","10.1016/j.bspc.2023.105088","https://www.scopus.com/inward/record.uri?eid=2-s2.0-85160695710&doi=10.1016%2fj.bspc.2023.105088&partnerID=40&md5=d17d32340f85d2ab5fbe8f5474612aef","Background: Transcutaneous oxygen tension (TcPO2) is a noninvasive method for assessing the oxygen supply of the skin in clinics. However, it is difficult to deploy broadly in primary care settings due to its high cost and time-consuming. This study proposed a fast and inexpensive technique for predicting TcPO2 using the characteristic features of the photoplethysmography (PPG) signals and various machine learning algorithms. Methods: The toe PPG signals of 149 subjects were collected, and 12 characteristic features were extracted according to contour analysis, followed by TcPO2 measurements. TcPO2 measurements were performed on the dorsum of the foot by PeriFlux 6000 TcPO2 system. In addition to PPG features, physiological parameters were also taken into account. A variety of machine learning regression approaches, including extreme gradient boost (XGBoost), random forest regression (RFR), support vector machine regression (SVR) and Ridge regression (Ridge), were used to predict TcPO2 levels. To evaluate the performance of machine learning algorithms, different performance indicators such as mean absolute error (MAE), root mean square error (RMSE), mean absolute percentage error (MAPE) and correlation coefficient were employed. Correlation analysis and Bland-Altman plot analysis were performed to visualize the data. Results: XGBoost outperformed the other three regression models in predicting TcPO2 (R = 0.835, MAE = 5.23 mmHg, RMSE = 6.87 mmHg, MAPE = 9.99%). Reflection index, diabetes, duration of diabetes, heart rate, crest time, the time between the systolic and diastolic peaks (ΔT) were the top six contributions to TcPO2 prediction in the XGBoost model. The PPG characteristic features play a dominant role in TcPO2 estimation. Diabetes and duration of diabetes were also significant factors in TcPO2 prediction. Conclusions: We compared four machine learning methods for TcPO2 prediction. The XGBoost model had the best predictive performance of all the algorithms investigated and could be used to forecast TcPO2 values. The TcPO2 prediction model based on PPG signal reduces the cost and shortens the measurement time of TcPO2, providing significant benefits for primary care. © 2023 Elsevier Ltd","Article","Final","","Scopus","2-s2.0-85160695710"
